Cleanup.ID,Zone,State,Country,Latitude,Longitude,Cleanup.Date,Group.Name,Adults,Children,People,Kilograms,Kilometers,N.bags,Cigarette.Butts,Food.Wrappers.candy.chips.etc.,Take.Out.Away.Containers.Plastic.,Take.Out.Away.Containers.Foam.,Bottle.Caps.Plastic.,Bottle.Caps.Metal.,Lids.Plastic.,Straws.Stirrers,Forks.Knives.Spoons,Beverage.Bottles.Plastic.,Beverage.Bottles.Glass.,Beverage.Cans,Grocery.Bags.Plastic.,Other.Plastic.Bags,Paper.Bags,Cups.Plates.Paper.,Cups.Plates.Plastic.,Cups.Plates.Foam.,Fishing.Buoys.Pots.Traps,Fishing.Net.Pieces,Fishing.Line.1.yard.meter.1.piece.,Rope.1.yard.meter.1.piece.,Fishing.Gear.Clean.Swell.,X6.Pack.Holders,Other.Plastic.Foam.Packaging,Other.Plastic.Bottles.oil.bleach.etc.,Strapping.Bands,Tobacco.Packaging.Wrap,Other.Packaging.Clean.Swell.,Beverages.Sachets,Appliances.refrigerators.washers.etc.,Balloons,Cigar.Tips,Cigarette.Lighters,Construction.Materials,Fireworks,Tires,Toys,Other.Trash.Clean.Swell.,E.cigarettes,Other.tobacco.packaging.lighter.etc.,Condoms,Diapers,Syringes,Tampons.Tampon.Applicators,Personal.Hygiene.Clean.Swell.,Gloves.Masks.PPE.,Foam.Pieces,Glass.Pieces,Plastic.Pieces,Total.Items.Collected,NewPlasticTotal,TotalFishing,totaltakeout,TotalSmoke,PlasticBags,year,month,day,DATE,distanceM,StdEffort,stdzdTotalPlastic,stdzdfish,stdzdtakeout,stdzdsmoke,stdzdbags
1101,"San Diego County, CA, USA","California, USA",United States,32.76146,-117.25047,10/16/15,,1,0,1,4.55,0.08,0,19,43,2,2,12,0,7,5,3,9,1,0,1,0,0,4,0,0,0,0,0,0,5,0,0,0,0,0,0,0,0,3,0,0,0,0,0,4,14,0,0,0,0,0,0,0,0,0,0,84,218,115,5,84,19,1,2015,10,16,2015-10-16,80,80,1.4375,0.0625,1.05,0.2375,0.0125
1102,"San Diego County, CA, USA","California, USA",United States,32.76559,-117.25246,10/20/15,,1,0,1,13.21,3.66,0,19,29,0,1,11,0,3,4,2,2,1,5,1,0,0,3,0,0,0,0,0,0,15,0,0,0,0,0,1,0,0,3,0,0,0,0,0,11,101,0,0,0,0,0,0,8,0,0,0,104,324,110,15,53,19,1,2015,10,20,2015-10-20,3660,3660,0.03005464481,0.004098360656,0.01448087432,0.005191256831,0.0002732240437
1105,"San Diego County, CA, USA","California, USA",United States,32.76785,-117.25265,10/17/15,,1,0,1,6.99,0.7,0,13,24,4,4,10,0,3,5,3,14,4,3,2,0,0,11,0,0,0,0,0,0,4,0,0,0,0,0,6,0,0,1,0,0,0,0,0,5,45,0,0,0,0,0,0,1,0,0,0,36,198,99,4,69,13,2,2015,10,17,2015-10-17,700,700,0.1414285714,0.005714285714,0.09857142857,0.01857142857,0.002857142857
1114,"San Diego County, CA, USA","California, USA",United States,32.76255,-117.25223,10/22/15,,1,0,1,2.47,3.57,0,1,15,0,0,3,0,0,5,0,0,0,0,1,0,0,1,0,0,0,0,0,0,4,0,0,0,0,0,4,0,0,3,0,0,0,0,0,0,15,0,0,0,0,0,0,4,0,0,0,47,103,40,4,24,1,1,2015,10,22,2015-10-22,3570,3570,0.01120448179,0.001120448179,0.006722689076,0.0002801120448,0.0002801120448
1126,"San Diego County, CA, USA","California, USA",United States,32.76244,-117.25228,10/27/15,,1,0,1,21.37,2.71,0,54,27,0,2,95,0,3,19,3,2,0,5,2,0,0,3,0,0,0,0,0,0,18,0,0,0,0,0,0,0,0,5,0,0,0,0,0,24,175,0,0,0,0,0,0,9,0,0,0,196,642,263,18,153,54,2,2015,10,27,2015-10-27,2710,2710,0.09704797048,0.006642066421,0.05645756458,0.01992619926,0.0007380073801
1128,"San Diego County, CA, USA","California, USA",United States,32.76238,-117.25257,10/28/15,,1,0,1,7.4,1.59,0,40,15,0,0,21,0,1,5,0,0,0,0,0,0,0,2,0,0,0,0,0,0,6,0,0,0,0,0,0,0,0,2,0,0,0,0,0,2,78,0,0,0,0,0,0,3,0,0,0,176,351,95,6,42,40,0,2015,10,28,2015-10-28,1590,1590,0.05974842767,0.003773584906,0.02641509434,0.0251572327,0
1129,"San Diego County, CA, USA","California, USA",United States,32.7611,-117.25191,11/2/15,,1,0,1,9.92,4.22,0,10,46,2,2,9,0,2,4,4,13,2,7,4,0,0,11,0,0,0,0,0,0,5,0,0,0,0,0,2,0,0,5,0,0,0,0,0,15,59,0,0,0,0,0,0,4,0,0,0,32,238,127,5,86,10,4,2015,11,2,2015-11-02,4220,4220,0.03009478673,0.001184834123,0.02037914692,0.002369668246,0.0009478672986
1135,"San Diego County, CA, USA","California, USA",United States,32.76238,-117.25257,10/28/15,,1,0,1,7.4,1.59,0,40,15,0,0,21,0,1,5,0,0,0,0,0,0,0,2,0,0,0,0,0,0,6,0,0,0,0,0,0,0,0,2,0,0,0,0,0,2,78,0,0,0,0,0,0,3,0,0,0,176,351,95,6,42,40,0,2015,10,28,2015-10-28,1590,1590,0.05974842767,0.003773584906,0.02641509434,0.0251572327,0
1146,"San Diego County, CA, USA","California, USA",United States,32.76169,-117.25051,11/1/15,,1,0,1,11.92,5.11,0,6,74,4,3,29,0,4,8,5,11,3,25,5,0,0,13,0,0,0,0,0,0,3,0,0,0,0,0,0,0,0,5,0,0,0,0,0,16,85,0,0,0,0,0,0,4,0,0,0,28,331,177,3,143,6,5,2015,11,1,2015-11-01,5110,5110,0.03463796477,0.0005870841487,0.02798434442,0.001174168297,0.0009784735812
1150,"San Diego County, CA, USA","California, USA",United States,32.76169,-117.25051,11/1/15,,1,0,1,11.92,5.11,0,6,74,4,3,29,0,4,8,5,11,3,25,5,0,0,13,0,0,0,0,0,0,3,0,0,0,0,0,0,0,0,5,0,0,0,0,0,16,85,0,0,0,0,0,0,4,0,0,0,28,331,177,3,143,6,5,2015,11,1,2015-11-01,5110,5110,0.03463796477,0.0005870841487,0.02798434442,0.001174168297,0.0009784735812
1151,"San Diego County, CA, USA","California, USA",United States,32.7611,-117.25191,11/2/15,,1,0,1,9.92,4.22,0,10,46,2,2,9,0,2,4,4,13,2,7,4,0,0,11,0,0,0,0,0,0,5,0,0,0,0,0,2,0,0,5,0,0,0,0,0,15,59,0,0,0,0,0,0,4,0,0,0,32,238,127,5,86,10,4,2015,11,2,2015-11-02,4220,4220,0.03009478673,0.001184834123,0.02037914692,0.002369668246,0.0009478672986
1170,"San Diego County, CA, USA","California, USA",United States,32.76207,-117.25224,11/3/15,,1,0,1,7.53,3.83,0,12,36,5,3,21,0,3,9,4,6,0,1,0,0,0,5,0,0,0,0,0,0,4,0,0,0,0,0,2,0,0,17,0,0,0,0,0,6,67,0,0,0,0,0,0,9,0,0,0,52,262,137,4,87,12,0,2015,11,3,2015-11-03,3830,3830,0.03577023499,0.001044386423,0.0227154047,0.003133159269,0
1171,"San Diego County, CA, USA","California, USA",United States,32.76207,-117.25224,11/3/15,,1,0,1,7.53,3.83,0,12,36,5,3,21,0,3,9,4,6,0,1,0,0,0,5,0,0,0,0,0,0,4,0,0,0,0,0,2,0,0,17,0,0,0,0,0,6,67,0,0,0,0,0,0,9,0,0,0,52,262,137,4,87,12,0,2015,11,3,2015-11-03,3830,3830,0.03577023499,0.001044386423,0.0227154047,0.003133159269,0
1175,"San Diego County, CA, USA","California, USA",United States,32.76152,-117.25109,11/6/15,,1,0,1,7.86,6.91,0,37,41,2,1,25,0,6,10,4,2,1,4,3,0,0,3,0,0,0,0,0,0,7,0,0,0,0,0,2,0,0,16,0,0,0,0,0,4,67,0,0,0,0,0,0,1,0,0,0,52,288,161,7,94,37,3,2015,11,6,2015-11-06,6910,6910,0.02329956585,0.001013024602,0.01360347323,0.005354558611,0.0004341534009
1176,"San Diego County, CA, USA","California, USA",United States,32.76152,-117.25109,11/6/15,,1,0,1,7.86,6.91,0,37,41,2,1,25,0,6,10,4,2,1,4,3,0,0,3,0,0,0,0,0,0,7,0,0,0,0,0,2,0,0,16,0,0,0,0,0,4,67,0,0,0,0,0,0,1,0,0,0,52,288,161,7,94,37,3,2015,11,6,2015-11-06,6910,6910,0.02329956585,0.001013024602,0.01360347323,0.005354558611,0.0004341534009
1177,"San Diego County, CA, USA","California, USA",United States,32.76152,-117.25109,11/6/15,,1,0,1,7.86,6.91,0,37,41,2,1,25,0,6,10,4,2,1,4,3,0,0,3,0,0,0,0,0,0,7,0,0,0,0,0,2,0,0,16,0,0,0,0,0,4,67,0,0,0,0,0,0,1,0,0,0,52,288,161,7,94,37,3,2015,11,6,2015-11-06,6910,6910,0.02329956585,0.001013024602,0.01360347323,0.005354558611,0.0004341534009
1180,"San Diego County, CA, USA","California, USA",United States,32.76155,-117.25083,11/8/15,,1,0,1,10.49,4.84,0,19,37,3,4,25,0,3,17,1,10,3,8,8,0,0,5,0,0,0,0,0,0,1,0,0,0,0,0,0,0,0,9,0,0,0,0,0,10,105,0,0,0,0,0,0,5,0,0,0,45,318,152,1,108,19,8,2015,11,8,2015-11-08,4840,4840,0.03140495868,0.0002066115702,0.02231404959,0.003925619835,0.001652892562
1185,"San Diego County, CA, USA","California, USA",United States,32.76155,-117.25083,11/8/15,,1,0,1,10.49,4.84,0,19,37,3,4,25,0,3,17,1,10,3,8,8,0,0,5,0,0,0,0,0,0,1,0,0,0,0,0,0,0,0,9,0,0,0,0,0,10,105,0,0,0,0,0,0,5,0,0,0,45,318,152,1,108,19,8,2015,11,8,2015-11-08,4840,4840,0.03140495868,0.0002066115702,0.02231404959,0.003925619835,0.001652892562
1230,"San Diego County, CA, USA","California, USA",United States,32.76177,-117.25054,11/12/15,,1,0,1,0.53,0.11,0,0,3,0,0,0,0,0,0,0,1,0,0,2,0,0,0,0,0,0,0,0,0,0,0,0,0,0,0,0,0,0,0,0,0,0,0,0,2,0,0,0,0,0,0,0,0,0,0,0,0,8,8,0,6,0,2,2015,11,12,2015-11-12,110,110,0.07272727273,0,0.05454545455,0,0.01818181818
2355,"San Diego County, CA, USA","California, USA",United States,33.21914,-117.37375,5/28/16,,3,0,3,0,0,0,0,0,0,0,0,0,0,0,0,0,0,0,0,0,0,0,0,0,0,0,0,0,0,0,0,0,0,0,0,0,0,1,0,0,0,0,0,0,0,0,0,0,0,0,0,0,0,0,0,0,1,1,0,0,0,0,2016,5,28,2016-05-28,0,0,Inf,NA,NA,NA,NA
2502,"San Diego County, CA, USA","California, USA",United States,32.94313,-117.15704,6/11/16,,1,0,1,0.09,0,0,5,0,0,0,0,0,0,0,0,1,0,0,0,0,0,0,0,0,0,0,0,0,0,0,0,0,0,0,0,0,0,0,0,0,0,0,0,0,1,0,0,0,0,0,0,0,0,0,0,0,7,6,0,1,5,0,2016,6,11,2016-06-11,0,0,Inf,NA,Inf,Inf,NA
2596,"San Diego County, CA, USA","California, USA",United States,33.04144,-117.29687,6/18/16,,2,0,2,3.14,0.78,0,5,16,0,0,1,0,0,1,0,0,0,1,2,0,0,1,0,0,0,0,0,0,7,0,0,0,0,0,0,0,0,1,0,0,0,0,0,1,15,0,0,0,0,0,0,0,0,0,0,25,76,34,7,20,5,2,2016,6,18,2016-06-18,780,1560,0.02179487179,0.004487179487,0.01282051282,0.003205128205,0.001282051282
2597,"San Diego County, CA, USA","California, USA",United States,32.5797,-117.13256,6/12/16,,1,0,1,0.03,1.38,0,0,0,0,0,0,0,0,0,0,1,0,0,0,0,0,1,0,0,0,0,0,0,0,0,0,0,0,0,0,0,0,0,0,0,0,0,0,0,0,0,0,0,0,0,0,0,0,0,0,0,2,1,0,1,0,0,2016,6,12,2016-06-12,1380,1380,0.0007246376812,0,0.0007246376812,0,0
2598,"San Diego County, CA, USA","California, USA",United States,33.04144,-117.29687,6/18/16,,2,0,2,3.14,0.78,0,5,16,0,0,1,0,0,1,0,0,0,1,2,0,0,1,0,0,0,0,0,0,7,0,0,0,0,0,0,0,0,1,0,0,0,0,0,1,15,0,0,0,0,0,0,0,0,0,0,25,76,34,7,20,5,2,2016,6,18,2016-06-18,780,1560,0.02179487179,0.004487179487,0.01282051282,0.003205128205,0.001282051282
2599,"San Diego County, CA, USA","California, USA",United States,32.5797,-117.13256,6/12/16,,1,0,1,0.03,1.38,0,0,0,0,0,0,0,0,0,0,1,0,0,0,0,0,1,0,0,0,0,0,0,0,0,0,0,0,0,0,0,0,0,0,0,0,0,0,0,0,0,0,0,0,0,0,0,0,0,0,0,2,1,0,1,0,0,2016,6,12,2016-06-12,1380,1380,0.0007246376812,0,0.0007246376812,0,0
2600,"San Diego County, CA, USA","California, USA",United States,33.04144,-117.29687,6/18/16,,2,0,2,3.14,0.78,0,5,16,0,0,1,0,0,1,0,0,0,1,2,0,0,1,0,0,0,0,0,0,7,0,0,0,0,0,0,0,0,1,0,0,0,0,0,1,15,0,0,0,0,0,0,0,0,0,0,25,76,34,7,20,5,2,2016,6,18,2016-06-18,780,1560,0.02179487179,0.004487179487,0.01282051282,0.003205128205,0.001282051282
2601,"San Diego County, CA, USA","California, USA",United States,33.04144,-117.29687,6/18/16,,2,0,2,3.14,0.78,0,5,16,0,0,1,0,0,1,0,0,0,1,2,0,0,1,0,0,0,0,0,0,7,0,0,0,0,0,0,0,0,1,0,0,0,0,0,1,15,0,0,0,0,0,0,0,0,0,0,25,76,34,7,20,5,2,2016,6,18,2016-06-18,780,1560,0.02179487179,0.004487179487,0.01282051282,0.003205128205,0.001282051282
2604,"San Diego County, CA, USA","California, USA",United States,33.04144,-117.29687,6/18/16,,2,0,2,3.14,0.78,0,5,16,0,0,1,0,0,1,0,0,0,1,2,0,0,1,0,0,0,0,0,0,7,0,0,0,0,0,0,0,0,1,0,0,0,0,0,1,15,0,0,0,0,0,0,0,0,0,0,25,76,34,7,20,5,2,2016,6,18,2016-06-18,780,1560,0.02179487179,0.004487179487,0.01282051282,0.003205128205,0.001282051282
2605,"San Diego County, CA, USA","California, USA",United States,33.04144,-117.29687,6/18/16,,2,0,2,3.14,0.78,0,5,16,0,0,1,0,0,1,0,0,0,1,2,0,0,1,0,0,0,0,0,0,7,0,0,0,0,0,0,0,0,1,0,0,0,0,0,1,15,0,0,0,0,0,0,0,0,0,0,25,76,34,7,20,5,2,2016,6,18,2016-06-18,780,1560,0.02179487179,0.004487179487,0.01282051282,0.003205128205,0.001282051282
2606,"San Diego County, CA, USA","California, USA",United States,32.5797,-117.13256,6/12/16,,1,0,1,0.03,1.38,0,0,0,0,0,0,0,0,0,0,1,0,0,0,0,0,1,0,0,0,0,0,0,0,0,0,0,0,0,0,0,0,0,0,0,0,0,0,0,0,0,0,0,0,0,0,0,0,0,0,0,2,1,0,1,0,0,2016,6,12,2016-06-12,1380,1380,0.0007246376812,0,0.0007246376812,0,0
2607,"San Diego County, CA, USA","California, USA",United States,32.5797,-117.13256,6/12/16,,1,0,1,0.03,1.38,0,0,0,0,0,0,0,0,0,0,1,0,0,0,0,0,1,0,0,0,0,0,0,0,0,0,0,0,0,0,0,0,0,0,0,0,0,0,0,0,0,0,0,0,0,0,0,0,0,0,0,2,1,0,1,0,0,2016,6,12,2016-06-12,1380,1380,0.0007246376812,0,0.0007246376812,0,0
2608,"San Diego County, CA, USA","California, USA",United States,32.5797,-117.13256,6/12/16,,1,0,1,0.03,1.38,0,0,0,0,0,0,0,0,0,0,1,0,0,0,0,0,1,0,0,0,0,0,0,0,0,0,0,0,0,0,0,0,0,0,0,0,0,0,0,0,0,0,0,0,0,0,0,0,0,0,0,2,1,0,1,0,0,2016,6,12,2016-06-12,1380,1380,0.0007246376812,0,0.0007246376812,0,0
2613,"San Diego County, CA, USA","California, USA",United States,32.5797,-117.13256,6/12/16,,1,0,1,0.03,1.38,0,0,0,0,0,0,0,0,0,0,1,0,0,0,0,0,1,0,0,0,0,0,0,0,0,0,0,0,0,0,0,0,0,0,0,0,0,0,0,0,0,0,0,0,0,0,0,0,0,0,0,2,1,0,1,0,0,2016,6,12,2016-06-12,1380,1380,0.0007246376812,0,0.0007246376812,0,0
2708,"San Diego County, CA, USA","California, USA",United States,32.79713,-117.25703,6/25/16,,2,0,2,2.22,0,0,40,6,0,0,1,0,0,4,2,0,1,0,1,0,0,0,0,0,0,0,0,0,0,0,0,0,0,0,1,0,0,0,0,0,0,0,0,0,14,0,0,0,0,0,0,0,0,0,0,217,287,55,0,14,40,1,2016,6,25,2016-06-25,0,0,Inf,NA,Inf,Inf,Inf
2775,"San Diego County, CA, USA","California, USA",United States,32.74796,-117.2528,7/5/16,,2,0,2,6.14,0.05,0,243,16,0,0,7,0,0,5,5,4,2,2,1,0,0,3,0,0,0,0,0,0,3,0,0,0,0,0,76,0,0,37,0,0,0,0,0,0,0,0,0,0,0,0,0,0,0,0,0,179,583,397,3,38,243,1,2016,7,5,2016-07-05,50,100,3.97,0.03,0.38,2.43,0.01
2933,"San Diego County, CA, USA","California, USA",United States,33.15829,-117.35389,7/24/16,,1,0,1,0.93,0.24,0,13,0,0,0,2,0,1,0,0,1,0,0,0,0,0,2,0,0,0,0,0,0,0,0,0,0,0,0,0,0,0,0,0,0,0,0,0,0,15,0,0,0,0,0,0,0,0,0,0,6,40,17,0,4,13,0,2016,7,24,2016-07-24,240,240,0.07083333333,0,0.01666666667,0.05416666667,0
2948,"San Diego County, CA, USA","California, USA",United States,33.15829,-117.35389,7/24/16,,1,0,1,0.93,0.24,0,13,0,0,0,2,0,1,0,0,1,0,0,0,0,0,2,0,0,0,0,0,0,0,0,0,0,0,0,0,0,0,0,0,0,0,0,0,0,15,0,0,0,0,0,0,0,0,0,0,6,40,17,0,4,13,0,2016,7,24,2016-07-24,240,240,0.07083333333,0,0.01666666667,0.05416666667,0
2956,"San Diego County, CA, USA","California, USA",United States,32.73682,-117.21469,7/25/16,,1,0,1,0,0.02,0,2,0,0,0,0,0,0,0,0,0,0,0,0,0,0,0,0,0,0,0,0,0,0,0,0,0,0,0,0,0,0,0,0,0,0,0,0,0,0,0,0,0,0,0,0,0,0,0,0,0,2,2,0,0,2,0,2016,7,25,2016-07-25,20,20,0.1,0,0,0.1,0
2960,"San Diego County, CA, USA","California, USA",United States,32.73699,-117.21443,7/26/16,,1,0,1,0.26,0,0,5,0,1,0,0,0,0,0,0,1,0,1,0,0,0,0,0,0,0,0,0,0,0,0,0,0,0,0,0,0,0,1,0,0,0,0,0,0,3,0,0,0,0,0,0,1,0,0,0,0,13,9,0,2,5,0,2016,7,26,2016-07-26,0,0,Inf,NA,Inf,Inf,NA
3126,"San Diego County, CA, USA","California, USA",United States,32.6921,-117.05109,8/26/16,,1,0,1,0.42,0.06,0,37,3,0,0,2,0,0,0,0,2,0,0,0,0,0,0,0,0,0,0,0,0,0,0,0,0,0,0,0,0,0,0,0,0,0,0,0,1,0,0,0,0,0,0,0,0,0,0,0,0,45,45,0,7,37,0,2016,8,26,2016-08-26,60,60,0.75,0,0.1166666667,0.6166666667,0
3136,"San Diego County, CA, USA","California, USA",United States,32.69668,-117.1502,8/27/16,The living Coast Discovery Center / clean sweep,200,0,200,104.18,0.01,0,294,181,157,134,66,0,74,71,70,180,95,55,156,0,0,0,107,0,0,0,0,0,77,0,0,0,0,0,124,0,0,33,0,0,0,0,0,113,241,0,0,0,0,0,0,22,0,0,0,137,2387,1859,77,1196,294,156,2016,8,27,2016-08-27,10,2000,0.9295,0.0385,0.598,0.147,0.078
3216,"San Diego County, CA, USA","California, USA",United States,32.77225,-117.25308,9/5/16,,1,0,1,0.18,0.01,0,3,2,0,0,0,0,0,0,0,0,0,0,0,0,0,0,0,0,0,0,0,0,0,0,0,0,0,0,1,0,0,0,0,0,0,0,0,0,2,0,0,0,0,0,0,0,0,0,0,0,8,6,0,2,3,0,2016,9,5,2016-09-05,10,10,0.6,0,0.2,0.3,0
3627,"San Diego County, CA, USA","California, USA",United States,33.24373,-117.30795,8/5/16,Cox,1,0,1,0.83,0,0,6,8,3,1,5,0,1,3,0,0,0,0,1,0,0,0,2,0,0,0,0,0,0,0,0,0,0,0,0,0,0,1,0,0,0,0,0,0,10,0,0,0,0,0,0,0,0,0,0,4,45,31,0,24,6,1,2016,8,5,2016-08-05,0,0,Inf,NA,Inf,Inf,Inf
3859,"San Diego County, CA, USA","California, USA",United States,33.15571,-117.35153,9/13/16,,1,0,1,0.07,0,0,0,1,0,0,0,0,0,0,0,0,0,0,2,0,0,0,0,0,0,0,0,0,0,0,0,0,0,0,1,0,0,0,0,0,0,0,0,0,0,0,0,0,0,0,0,0,0,0,0,0,4,4,0,3,0,2,2016,9,13,2016-09-13,0,0,Inf,NA,Inf,NA,Inf
3887,"San Diego County, CA, USA","California, USA",United States,33.14392,-117.34239,9/14/16,LEGOLAND California,1,0,1,0.2,0.54,0,2,1,0,0,5,0,2,2,0,4,0,0,2,0,0,0,0,0,0,0,0,0,0,0,0,0,0,0,1,0,0,0,0,0,0,0,0,0,0,0,0,0,0,0,0,0,0,0,0,4,23,19,0,16,2,2,2016,9,14,2016-09-14,540,540,0.03518518519,0,0.02962962963,0.003703703704,0.003703703704
3901,"San Diego County, CA, USA","California, USA",United States,33.12732,-117.24423,9/15/16,,1,0,1,0.01,0,0,4,0,0,0,0,0,0,0,0,0,0,0,0,0,0,0,0,0,0,0,0,0,0,0,0,0,0,0,0,0,0,0,0,0,0,0,0,0,0,0,0,0,0,0,0,0,0,0,0,0,4,4,0,0,4,0,2016,9,15,2016-09-15,0,0,Inf,NA,NA,Inf,NA
3922,"San Diego County, CA, USA","California, USA",United States,32.99695,-117.24914,9/15/16,,1,0,1,3.06,0.03,0,7,20,6,0,7,0,3,4,0,0,9,0,5,0,0,0,1,0,0,0,0,0,0,0,0,0,0,0,1,0,0,5,0,0,0,0,0,1,3,0,0,0,0,0,0,0,0,0,0,3,75,60,0,46,7,5,2016,9,15,2016-09-15,30,30,2,0,1.533333333,0.2333333333,0.1666666667
3925,"San Diego County, CA, USA","California, USA",United States,33.21305,-117.38657,9/15/16,Oceanside #1,1,0,1,0.38,1.71,0,3,8,0,0,2,0,0,0,0,0,0,0,0,0,0,0,0,0,0,0,0,0,0,0,0,0,0,0,2,0,0,1,0,0,0,0,0,0,3,0,0,0,0,0,0,0,0,0,0,3,22,16,0,10,3,0,2016,9,15,2016-09-15,1710,1710,0.009356725146,0,0.005847953216,0.001754385965,0
3937,"San Diego County, CA, USA","California, USA",United States,32.86916,-117.25298,9/16/16,California Sea Grant,1,0,1,0,0.03,0,0,0,0,0,0,0,0,0,1,0,0,0,0,0,0,0,0,0,0,0,0,0,0,0,0,0,0,0,0,0,0,0,0,0,0,0,0,0,0,0,0,0,0,0,0,0,0,0,0,0,1,1,0,1,0,0,2016,9,16,2016-09-16,30,30,0.03333333333,0,0.03333333333,0,0
3989,"San Diego County, CA, USA","California, USA",United States,33.16591,-117.31844,9/16/16,,1,0,1,0,0.06,0,0,0,0,0,0,0,0,0,0,0,0,0,0,0,0,0,0,0,0,0,0,0,0,0,0,0,0,0,0,0,0,0,0,0,0,0,0,0,0,0,0,0,0,0,0,0,0,0,0,0,0,0,0,0,0,0,2016,9,16,2016-09-16,60,60,0,0,0,0,0
4544,"San Diego County, CA, USA","California, USA",United States,32.76326,-117.12099,9/17/16,Sugar,1,0,1,2,0,0,0,3,0,0,0,0,0,0,0,0,0,0,0,0,0,0,0,0,0,0,0,0,0,0,0,0,0,0,1,0,0,0,0,0,0,0,0,0,6,0,0,0,0,0,0,0,0,0,0,0,10,4,0,3,0,0,2016,9,17,2016-09-17,0,0,Inf,NA,Inf,NA,NA
4652,"San Diego County, CA, USA","California, USA",United States,32.80261,-117.22212,9/17/16,,1,0,1,2.57,0,0,12,18,7,3,0,0,4,0,0,5,6,0,13,0,0,0,2,0,0,0,0,0,0,0,0,0,0,0,0,0,0,0,0,0,0,0,0,0,7,0,0,0,0,0,0,0,0,0,0,5,82,64,0,52,12,13,2016,9,17,2016-09-17,0,0,Inf,NA,Inf,Inf,Inf
4729,"San Diego County, CA, USA","California, USA",United States,33.1378,-117.33867,9/17/16,,3,0,3,1.63,0.3,0,11,5,1,0,7,0,0,4,1,0,0,1,0,0,0,0,0,0,0,0,0,0,1,0,0,0,0,0,2,0,0,2,0,0,0,0,0,1,11,0,0,0,0,0,0,4,0,0,0,55,106,39,1,18,11,0,2016,9,17,2016-09-17,300,900,0.04333333333,0.001111111111,0.02,0.01222222222,0
4734,"San Diego County, CA, USA","California, USA",United States,33.00399,-117.11556,9/17/16,Boy Scout pack 594 den 7,1,0,1,0.52,1.62,0,0,4,2,0,7,0,0,1,2,0,0,0,0,0,0,0,0,0,0,0,0,0,0,0,0,0,0,0,0,0,0,2,0,0,0,0,0,0,4,0,0,0,0,0,0,0,0,0,0,36,58,18,0,16,0,0,2016,9,17,2016-09-17,1620,1620,0.01111111111,0,0.00987654321,0,0
4742,"San Diego County, CA, USA","California, USA",United States,32.96135,-117.26785,9/17/16,,4,0,4,1.27,1.29,0,20,4,1,0,4,0,1,4,1,1,1,1,0,0,0,0,0,0,0,0,0,0,3,0,0,0,0,0,0,0,0,0,0,0,0,0,0,0,1,0,0,0,0,0,0,2,0,0,0,5,49,41,3,16,20,0,2016,9,17,2016-09-17,1290,5160,0.007945736434,0.0005813953488,0.003100775194,0.003875968992,0
4748,"San Diego County, CA, USA","California, USA",United States,33.01926,-117.28379,9/17/16,,3,0,3,0.9,0.56,0,6,5,0,0,2,0,2,3,0,1,0,0,0,0,0,0,0,0,0,0,0,0,0,0,0,0,0,0,0,0,0,0,0,0,0,0,0,1,2,0,0,0,0,0,0,0,0,0,0,100,122,20,0,13,6,0,2016,9,17,2016-09-17,560,1680,0.0119047619,0,0.007738095238,0.003571428571,0
4749,"San Diego County, CA, USA","California, USA",United States,33.00367,-117.115,9/17/16,,2,0,2,2.74,0.41,0,2,22,0,0,3,0,0,1,2,1,2,0,1,0,0,0,1,0,0,0,0,0,0,0,0,0,0,0,6,0,0,9,0,0,0,0,0,0,28,0,0,0,0,0,0,3,0,0,0,19,100,51,0,31,2,1,2016,9,17,2016-09-17,410,820,0.06219512195,0,0.03780487805,0.00243902439,0.001219512195
4751,"San Diego County, CA, USA","California, USA",United States,33.0018,-117.27774,9/17/16,,3,0,3,1.33,1.41,0,12,13,0,0,1,0,0,3,0,1,0,1,1,0,0,0,0,0,0,0,0,0,0,0,0,0,0,0,2,0,0,3,0,0,0,0,0,1,12,0,0,0,0,0,0,3,0,0,0,12,65,40,0,19,12,1,2016,9,17,2016-09-17,1410,4230,0.009456264775,0,0.004491725768,0.002836879433,0.0002364066194
4756,"San Diego County, CA, USA","California, USA",United States,32.93612,-117.25977,9/17/16,,1,0,1,1.28,0.28,0,13,4,0,0,4,0,3,0,0,0,0,0,3,0,0,0,0,0,0,0,0,0,0,0,0,0,0,0,6,0,0,0,0,0,0,0,0,0,15,0,0,0,0,0,0,4,0,0,0,8,60,37,0,14,13,3,2016,9,17,2016-09-17,280,280,0.1321428571,0,0.05,0.04642857143,0.01071428571
4758,"San Diego County, CA, USA","California, USA",United States,33.02102,-117.28461,9/17/16,Tvia- September 17,1,0,1,0.97,4.43,0,11,9,3,0,1,0,0,0,0,0,0,0,1,0,0,0,1,0,0,0,0,0,2,0,0,0,0,0,0,0,0,0,0,0,0,0,0,0,4,0,0,0,0,0,0,0,0,0,0,2,34,28,2,15,11,1,2016,9,17,2016-09-17,4430,4430,0.006320541761,0.0004514672686,0.003386004515,0.002483069977,0.0002257336343
4761,"San Diego County, CA, USA","California, USA",United States,33.0037,-117.11502,9/17/16,,2,0,2,0.54,1.42,0,2,13,0,0,3,0,0,1,0,0,0,0,1,0,0,0,0,0,0,0,0,0,0,0,0,0,0,0,1,0,0,1,0,0,0,0,0,0,4,0,0,0,0,0,0,0,0,0,0,19,45,22,0,18,2,1,2016,9,17,2016-09-17,1420,2840,0.007746478873,0,0.006338028169,0.0007042253521,0.0003521126761
4764,"San Diego County, CA, USA","California, USA",United States,33.0044,-117.11593,9/17/16,,1,0,1,1.06,1.04,0,37,10,0,0,0,0,3,0,1,0,0,0,1,0,0,0,0,0,0,0,0,0,0,0,0,0,0,0,5,0,0,1,0,0,0,0,0,1,6,0,0,0,0,0,0,0,0,0,0,12,77,59,0,15,37,1,2016,9,17,2016-09-17,1040,1040,0.05673076923,0,0.01442307692,0.03557692308,0.0009615384615
4766,"San Diego County, CA, USA","California, USA",United States,32.73247,-117.15878,9/17/16,Banker's Hill Street Sweep,2,0,2,2.69,0.13,0,168,17,7,0,18,0,1,10,2,0,0,0,1,0,0,0,5,0,0,0,0,0,0,0,0,0,0,0,1,0,0,1,0,0,0,0,0,2,13,0,0,0,0,0,0,0,0,0,0,112,358,233,0,61,168,1,2016,9,17,2016-09-17,130,260,0.8961538462,0,0.2346153846,0.6461538462,0.003846153846
4767,"San Diego County, CA, USA","California, USA",United States,32.93305,-117.2536,9/17/16,,2,0,2,2.21,36.62,0,10,4,0,0,2,0,0,2,0,2,7,2,2,0,0,0,0,0,0,0,0,0,0,0,0,0,0,0,1,0,0,1,0,0,0,0,0,0,6,0,0,0,0,0,0,1,0,0,0,8,48,25,0,12,10,2,2016,9,17,2016-09-17,36620,73240,0.0003413435281,0,0.0001638448935,0.0001365374113,2.73E-05
4771,"San Diego County, CA, USA","California, USA",United States,32.73336,-117.15897,9/17/16,Bankers hill street sweep,5,0,5,27.73,0.32,0,610,15,7,37,79,0,8,22,0,3,0,3,39,0,0,0,2,0,0,0,0,0,6,0,0,0,0,0,7,0,0,7,0,0,0,0,0,6,347,0,0,0,0,0,0,22,0,0,0,370,1590,870,6,212,610,39,2016,9,17,2016-09-17,320,1600,0.54375,0.00375,0.1325,0.38125,0.024375
4774,"San Diego County, CA, USA","California, USA",United States,32.99134,-117.27458,9/17/16,1,3,0,3,1.15,0.58,0,15,3,3,0,1,0,0,4,0,0,0,0,0,0,0,0,0,0,0,0,0,0,0,0,0,0,0,0,0,0,0,0,0,0,0,0,0,0,15,0,0,0,0,0,0,1,0,0,0,34,76,27,0,11,15,0,2016,9,17,2016-09-17,580,1740,0.01551724138,0,0.00632183908,0.008620689655,0
4778,"San Diego County, CA, USA","California, USA",United States,32.93529,-117.25985,9/17/16,,2,0,2,2.69,0.84,0,6,18,0,0,2,0,1,2,0,0,0,0,0,0,0,0,0,0,0,0,0,0,0,0,0,0,0,0,1,0,0,0,0,0,0,0,0,0,35,0,0,0,0,0,0,1,0,0,0,103,169,31,0,23,6,0,2016,9,17,2016-09-17,840,1680,0.01845238095,0,0.01369047619,0.003571428571,0
4783,"San Diego County, CA, USA","California, USA",United States,32.77001,-117.25264,9/17/16,Hartford,3,0,3,0.64,0.35,0,1,0,0,0,0,0,0,0,0,0,0,0,0,0,0,0,0,0,0,0,0,0,0,0,0,0,0,0,12,0,0,0,0,0,0,0,0,0,3,0,0,0,0,0,0,0,0,0,0,3,19,13,0,0,1,0,2016,9,17,2016-09-17,350,1050,0.01238095238,0,0,0.0009523809524,0
4789,"San Diego County, CA, USA","California, USA",United States,32.77009,-117.12137,9/17/16,,1,0,1,0.78,0.01,0,51,3,1,0,3,0,1,4,0,0,0,0,0,0,0,0,0,0,0,0,0,0,0,0,0,0,0,0,0,0,0,0,0,0,0,0,0,0,10,0,0,0,0,0,0,0,0,0,0,3,76,63,0,12,51,0,2016,9,17,2016-09-17,10,10,6.3,0,1.2,5.1,0
4793,"San Diego County, CA, USA","California, USA",United States,32.84357,-116.99709,9/17/16,,2,0,2,6.89,1.48,0,112,15,6,1,5,0,11,4,2,10,2,8,6,0,0,0,17,0,0,0,0,0,0,0,0,0,0,0,7,0,0,0,0,0,0,0,0,0,87,0,0,0,0,0,0,1,0,0,0,28,322,197,0,77,112,6,2016,9,17,2016-09-17,1480,2960,0.06655405405,0,0.02601351351,0.03783783784,0.002027027027
4794,"San Diego County, CA, USA","California, USA",United States,33.00371,-117.11495,9/17/16,,2,0,2,2.13,1.72,0,3,6,1,0,2,0,1,2,0,9,2,0,10,0,0,0,3,0,0,0,0,0,0,0,0,0,0,0,2,0,0,2,0,0,0,0,0,5,0,0,0,0,0,0,0,0,0,0,0,5,53,46,0,34,3,10,2016,9,17,2016-09-17,1720,3440,0.01337209302,0,0.00988372093,0.0008720930233,0.002906976744
4797,"San Diego County, CA, USA","California, USA",United States,32.68328,-117.18327,9/17/16,,1,0,1,3.04,1.51,0,18,22,1,0,3,0,1,3,1,6,3,1,1,0,0,0,1,0,0,0,0,0,4,0,0,0,0,0,0,0,0,0,0,0,0,0,0,0,11,0,0,0,0,0,0,4,0,0,0,34,114,65,4,39,18,1,2016,9,17,2016-09-17,1510,1510,0.04304635762,0.002649006623,0.02582781457,0.0119205298,0.0006622516556
4801,"San Diego County, CA, USA","California, USA",United States,32.753,-117.25115,9/17/16,,2,0,2,0.29,2.35,0,15,0,0,0,4,0,0,1,0,0,0,1,1,0,0,0,0,0,0,0,0,0,0,0,0,0,0,0,0,0,0,0,0,0,0,0,0,0,3,0,0,0,0,0,0,0,0,0,0,14,39,21,0,6,15,1,2016,9,17,2016-09-17,2350,4700,0.004468085106,0,0.001276595745,0.003191489362,0.0002127659574
4802,"San Diego County, CA, USA","California, USA",United States,32.75541,-117.25171,9/17/16,Ocean beach dog beach,1,0,1,0.19,0.15,0,7,4,0,2,3,0,0,2,0,0,0,0,1,0,0,0,0,0,0,0,0,0,0,0,0,0,0,0,1,0,0,0,0,0,0,0,0,0,0,0,0,0,0,0,0,0,0,0,0,3,23,20,0,12,7,1,2016,9,17,2016-09-17,150,150,0.1333333333,0,0.08,0.04666666667,0.006666666667
4804,"San Diego County, CA, USA","California, USA",United States,33.13733,-117.33869,9/17/16,LEGOLAND California,1,0,1,0.44,4.52,0,5,1,0,3,2,0,0,2,0,0,0,0,0,0,0,0,0,0,0,0,0,0,0,0,0,0,0,0,1,0,0,0,0,0,0,0,0,0,3,0,0,0,0,0,0,0,0,0,0,27,44,14,0,8,5,0,2016,9,17,2016-09-17,4520,4520,0.003097345133,0,0.001769911504,0.00110619469,0
4805,"San Diego County, CA, USA","California, USA",United States,33.13915,-117.33944,9/17/16,C,1,0,1,0.59,0.76,0,6,2,0,0,3,0,1,5,0,1,0,0,0,0,0,0,0,0,0,0,0,0,0,0,0,0,0,0,3,0,0,1,0,0,0,0,0,0,3,0,0,0,0,0,0,0,0,0,0,52,77,22,0,12,6,0,2016,9,17,2016-09-17,760,760,0.02894736842,0,0.01578947368,0.007894736842,0
4814,"San Diego County, CA, USA","California, USA",United States,32.76323,-117.12128,9/17/16,Sugar,1,0,1,31.93,0.08,0,1,0,0,0,10,0,0,0,0,0,0,0,0,0,0,0,0,0,0,0,0,0,0,0,0,0,0,0,0,0,0,0,0,0,0,0,0,0,7,0,0,0,0,0,0,0,0,0,0,0,18,11,0,10,1,0,2016,9,17,2016-09-17,80,80,0.1375,0,0.125,0.0125,0
4817,"San Diego County, CA, USA","California, USA",United States,32.76338,-117.12089,9/17/16,Sugar,1,0,1,0.4,0.03,0,0,0,0,0,0,0,0,0,0,0,0,0,0,0,0,0,0,0,0,0,0,0,0,0,0,0,0,0,0,0,0,0,0,0,0,0,0,0,0,0,0,0,0,0,0,0,0,0,0,0,0,0,0,0,0,0,2016,9,17,2016-09-17,30,30,0,0,0,0,0
4819,"San Diego County, CA, USA","California, USA",United States,32.7826,-117.25115,9/17/16,Girl Scouts troop 2014,11,0,11,5.67,0.62,0,227,25,11,0,38,0,0,4,1,6,1,0,0,0,0,0,0,0,0,0,0,0,0,0,0,0,0,0,12,0,0,7,0,0,0,0,0,8,107,0,0,0,0,0,0,23,0,0,0,89,559,362,0,85,227,0,2016,9,17,2016-09-17,620,6820,0.05307917889,0,0.01246334311,0.03328445748,0
4820,"San Diego County, CA, USA","California, USA",United States,32.79759,-117.21351,9/17/16,,1,0,1,4.25,1.95,0,133,29,2,3,3,0,8,6,1,2,2,1,0,0,0,0,3,0,0,0,0,0,0,0,0,0,0,0,35,0,0,6,0,0,0,0,0,0,23,0,0,0,0,0,0,0,0,0,0,38,295,231,0,57,133,0,2016,9,17,2016-09-17,1950,1950,0.1184615385,0,0.02923076923,0.06820512821,0
4821,"San Diego County, CA, USA","California, USA",United States,32.85492,-117.25896,9/17/16,Morning Creek,3,0,3,1.39,0.85,0,8,6,0,0,2,0,1,1,1,0,0,0,1,0,0,0,0,0,0,0,0,0,0,0,0,0,0,0,0,0,0,1,0,0,0,0,0,0,19,0,0,0,0,0,0,0,0,0,0,51,91,21,0,12,8,1,2016,9,17,2016-09-17,850,2550,0.008235294118,0,0.004705882353,0.003137254902,0.0003921568627
4827,"San Diego County, CA, USA","California, USA",United States,32.74618,-117.05844,9/17/16,,4,0,4,7.33,0.36,0,0,17,11,0,0,0,3,0,0,7,23,5,29,0,0,0,4,0,0,0,0,0,0,0,0,0,0,0,0,0,0,0,0,0,0,0,0,1,14,0,0,0,0,0,0,1,0,0,0,0,115,73,0,71,0,29,2016,9,17,2016-09-17,360,1440,0.05069444444,0,0.04930555556,0,0.02013888889
4840,"San Diego County, CA, USA","California, USA",United States,32.97886,-117.24861,9/17/16,,2,0,2,0.91,3.68,0,4,6,0,0,5,0,0,3,2,2,7,1,1,0,0,0,0,0,0,0,0,0,0,0,0,0,0,0,0,0,0,0,0,0,0,0,0,1,19,0,0,0,0,0,0,1,0,0,0,0,52,25,0,19,4,1,2016,9,17,2016-09-17,3680,7360,0.00339673913,0,0.002581521739,0.0005434782609,0.0001358695652
4841,"San Diego County, CA, USA","California, USA",United States,32.73284,-117.15897,9/17/16,Bankers Hill Street Sweep,1,0,1,5.21,1.01,0,102,0,0,0,6,0,0,0,0,0,0,1,0,0,0,0,0,0,0,0,0,0,0,0,0,0,0,0,5,0,0,0,0,0,0,0,0,0,83,0,0,0,0,0,0,7,0,0,0,16,220,120,0,6,102,0,2016,9,17,2016-09-17,1010,1010,0.1188118812,0,0.005940594059,0.100990099,0
4842,"San Diego County, CA, USA","California, USA",United States,33.02249,-117.28566,9/17/16,Chambers,5,0,5,6.68,0.96,0,20,13,1,2,0,0,6,7,5,4,6,0,1,0,0,0,2,0,0,0,0,0,0,0,0,0,0,0,5,0,0,0,0,0,0,0,0,0,75,0,0,0,0,0,0,4,0,0,0,105,256,70,0,41,20,1,2016,9,17,2016-09-17,960,4800,0.01458333333,0,0.008541666667,0.004166666667,0.0002083333333
4845,"San Diego County, CA, USA","California, USA",United States,33.00376,-117.11505,9/17/16,,1,0,1,2.93,4.33,0,0,12,1,0,2,0,1,0,0,18,1,3,9,0,0,0,4,0,0,0,0,0,0,0,0,0,0,0,0,0,0,0,0,0,0,0,0,0,36,0,0,0,0,0,0,0,0,0,0,0,87,47,0,47,0,9,2016,9,17,2016-09-17,4330,4330,0.01085450346,0,0.01085450346,0,0.00207852194
4847,"San Diego County, CA, USA","California, USA",United States,32.62294,-117.08751,9/17/16,,1,0,1,2.02,0,0,26,16,14,15,11,0,13,8,2,2,3,0,0,0,0,0,5,0,0,0,0,0,0,0,0,0,0,0,0,0,0,1,0,0,0,0,0,0,0,0,0,0,0,0,0,1,0,0,0,16,133,114,0,86,26,0,2016,9,17,2016-09-17,0,0,Inf,NA,Inf,Inf,NA
4852,"San Diego County, CA, USA","California, USA",United States,33.00358,-117.11514,9/17/16,Boys team charity,1,0,1,0.68,1.95,0,0,4,0,0,0,0,0,2,0,6,0,2,4,0,0,0,2,0,0,0,0,0,0,0,0,0,0,0,1,0,0,0,0,0,0,0,0,0,7,0,0,0,0,0,0,0,0,0,0,0,28,19,0,18,0,4,2016,9,17,2016-09-17,1950,1950,0.009743589744,0,0.009230769231,0,0.002051282051
4855,"San Diego County, CA, USA","California, USA",United States,32.69689,-117.18146,9/17/16,Helen and Sophia ,2,0,2,2.2,18.77,0,36,69,0,0,0,0,0,0,0,0,0,0,0,0,0,0,0,0,0,0,0,0,0,0,0,0,0,0,10,0,0,2,0,0,0,0,0,0,6,0,0,0,0,0,0,2,0,0,0,98,223,119,0,69,36,0,2016,9,17,2016-09-17,18770,37540,0.003169952051,0,0.001838039425,0.0009589770911,0
4859,"San Diego County, CA, USA","California, USA",United States,32.78245,-117.2511,9/17/16,,1,0,1,5.61,2.3,0,160,17,2,1,9,0,0,3,4,3,1,0,0,0,0,0,2,0,0,0,0,0,0,0,0,0,0,0,3,0,0,0,0,0,0,0,0,0,80,0,0,0,0,0,0,0,0,0,0,10,295,204,0,41,160,0,2016,9,17,2016-09-17,2300,2300,0.08869565217,0,0.01782608696,0.06956521739,0
4866,"San Diego County, CA, USA","California, USA",United States,32.8569,-117.25637,9/17/16,,1,0,1,2.79,2.01,0,11,0,1,0,6,0,0,0,1,0,0,0,2,0,0,0,0,0,0,0,0,0,0,0,0,0,0,0,0,0,0,2,0,0,0,0,0,3,37,0,0,0,0,0,0,0,0,0,0,0,63,26,0,10,11,2,2016,9,17,2016-09-17,2010,2010,0.01293532338,0,0.004975124378,0.005472636816,0.0009950248756
4867,"San Diego County, CA, USA","California, USA",United States,33.19745,-117.38666,9/17/16,,1,0,1,2.95,1.19,0,34,29,0,0,3,0,7,6,1,0,0,0,0,0,0,0,0,0,0,0,0,0,0,0,0,0,0,0,1,0,0,0,0,0,0,0,0,3,26,0,0,0,0,0,0,1,0,0,0,65,176,85,0,46,34,0,2016,9,17,2016-09-17,1190,1190,0.07142857143,0,0.03865546218,0.02857142857,0
4868,"San Diego County, CA, USA","California, USA",United States,32.7537,-117.25162,9/17/16,,1,0,1,1.43,6.02,0,25,11,0,0,7,0,1,1,0,0,0,0,0,0,0,0,0,0,0,0,0,0,0,0,0,0,0,0,0,0,0,0,0,0,0,0,0,1,16,0,0,0,0,0,0,2,0,0,0,16,80,48,0,20,25,0,2016,9,17,2016-09-17,6020,6020,0.007973421927,0,0.003322259136,0.00415282392,0
4870,"San Diego County, CA, USA","California, USA",United States,32.7827,-117.25149,9/17/16,Valhalla Volleyball ,6,0,6,3.54,3.02,0,40,3,2,0,8,0,1,0,4,6,3,0,0,0,0,0,1,0,0,0,0,0,0,0,0,0,0,0,1,0,0,0,0,0,0,0,0,0,51,0,0,0,0,0,0,0,0,0,0,33,153,66,0,25,40,0,2016,9,17,2016-09-17,3020,18120,0.003642384106,0,0.001379690949,0.002207505519,0
4873,"San Diego County, CA, USA","California, USA",United States,33.137,-117.33845,9/17/16,Houseofhowell,4,0,4,3.47,2.84,0,23,6,1,0,10,0,4,0,2,3,5,3,4,0,0,0,0,0,0,0,0,0,2,0,0,0,0,0,2,0,0,6,0,0,0,0,0,3,10,0,0,0,0,0,0,3,0,0,0,20,107,69,2,30,23,4,2016,9,17,2016-09-17,2840,11360,0.006073943662,0.000176056338,0.00264084507,0.002024647887,0.0003521126761
4876,"San Diego County, CA, USA","California, USA",United States,32.75431,-117.25159,9/17/16,,5,0,5,2.9,6.31,0,18,30,8,0,4,0,3,2,0,5,0,4,5,0,0,0,3,0,0,0,0,0,1,0,0,0,0,0,0,0,0,0,0,0,0,0,0,0,32,0,0,0,0,0,0,0,0,0,0,1,116,79,1,60,18,5,2016,9,17,2016-09-17,6310,31550,0.002503961965,3.17E-05,0.001901743265,0.0005705229794,0.0001584786054
4879,"San Diego County, CA, USA","California, USA",United States,33.00369,-117.11509,9/17/16,,1,0,1,0.43,4.11,0,3,6,0,0,0,0,0,0,0,1,0,0,1,0,0,0,0,0,0,0,0,0,0,0,0,0,0,0,0,0,0,1,0,0,0,0,0,0,4,0,0,0,0,0,0,0,0,0,0,19,35,12,0,8,3,1,2016,9,17,2016-09-17,4110,4110,0.002919708029,0,0.001946472019,0.0007299270073,0.0002433090024
4884,"San Diego County, CA, USA","California, USA",United States,33.02112,-117.28451,9/17/16,Coastal Cleanup - Sharp,1,0,1,4.02,2.57,0,69,17,0,0,9,0,0,6,3,2,0,1,6,0,0,0,0,0,0,0,0,0,0,0,0,0,0,0,0,0,0,1,0,0,0,0,0,1,52,0,0,0,0,0,0,0,0,0,0,90,257,114,0,43,69,6,2016,9,17,2016-09-17,2570,2570,0.04435797665,0,0.01673151751,0.02684824903,0.00233463035
4885,"San Diego County, CA, USA","California, USA",United States,32.9522,-117.04651,9/17/16,,1,0,1,1.05,1.98,0,10,11,1,0,0,0,2,0,0,0,2,6,8,0,0,0,10,0,0,0,0,0,0,0,0,0,0,0,1,0,0,1,0,0,0,0,0,0,2,0,0,0,0,0,0,0,0,0,0,1,55,44,0,32,10,8,2016,9,17,2016-09-17,1980,1980,0.02222222222,0,0.01616161616,0.005050505051,0.00404040404
4886,"San Diego County, CA, USA","California, USA",United States,32.75423,-117.25212,9/17/16,"HKS, Inc",7,0,7,0.73,0.62,0,7,6,0,0,4,0,0,0,0,0,0,0,2,0,0,0,0,0,0,0,0,0,1,0,0,0,0,0,2,0,0,0,0,0,0,0,0,0,4,0,0,0,0,0,0,0,0,0,0,17,43,22,1,12,7,2,2016,9,17,2016-09-17,620,4340,0.005069124424,0.0002304147465,0.002764976959,0.001612903226,0.0004608294931
4892,"San Diego County, CA, USA","California, USA",United States,32.79737,-117.25733,9/17/16,,1,0,1,0.23,0.14,0,0,0,0,0,0,0,0,0,0,0,1,0,0,0,0,0,0,0,0,0,0,0,0,0,0,0,0,0,0,0,0,0,0,0,0,0,0,0,0,0,0,0,0,0,0,0,0,0,0,0,1,0,0,0,0,0,2016,9,17,2016-09-17,140,140,0,0,0,0,0
4901,"San Diego County, CA, USA","California, USA",United States,32.85679,-117.25729,9/17/16,Morning Creek Elementary,3,0,3,1.7,1.24,0,15,13,0,0,4,0,0,2,2,0,1,0,0,0,0,0,0,0,0,0,0,0,0,0,0,0,0,0,0,0,0,0,0,0,0,0,0,0,14,0,0,0,0,0,0,1,0,0,0,101,153,37,0,21,15,0,2016,9,17,2016-09-17,1240,3720,0.009946236559,0,0.00564516129,0.004032258065,0
4902,"San Diego County, CA, USA","California, USA",United States,33.17216,-117.3205,9/17/16,SD County Beach Cleanup Day,1,0,1,0.11,11.78,0,5,5,0,0,2,0,0,0,0,0,0,0,0,0,0,0,0,0,0,0,0,0,0,0,0,0,0,0,0,0,0,0,0,0,0,0,0,0,0,0,0,0,0,0,0,0,0,0,0,6,18,12,0,7,5,0,2016,9,17,2016-09-17,11780,11780,0.001018675722,0,0.0005942275042,0.0004244482173,0
4904,"San Diego County, CA, USA","California, USA",United States,32.73325,-117.15904,9/17/16,Bankers hill street sweep,4,0,4,21.19,0.78,0,413,37,1,7,28,0,1,3,2,0,0,1,8,0,0,0,2,0,0,0,0,0,0,0,0,0,0,0,0,0,0,0,0,0,0,0,0,0,343,0,0,0,0,0,0,4,0,0,0,102,952,506,0,89,413,8,2016,9,17,2016-09-17,780,3120,0.1621794872,0,0.02852564103,0.1323717949,0.002564102564
4910,"San Diego County, CA, USA","California, USA",United States,32.75236,-117.25198,9/17/16,Siege Media,11,0,11,5.05,2.85,0,95,20,7,11,7,0,5,3,6,3,3,1,3,0,0,0,4,0,0,0,0,0,0,0,0,0,0,0,9,0,0,0,0,0,0,0,0,0,41,0,0,0,0,0,0,2,0,0,0,119,339,175,0,69,95,3,2016,9,17,2016-09-17,2850,31350,0.005582137161,0,0.002200956938,0.00303030303,9.57E-05
4911,"San Diego County, CA, USA","California, USA",United States,33.10398,-117.20169,9/17/16,San Elijo Hills Trail Cleanup,4,0,4,1.65,2.07,0,12,13,0,0,1,0,1,1,0,1,0,0,2,0,0,0,0,0,0,0,0,0,0,0,0,0,0,0,9,0,0,0,0,0,0,0,0,0,18,0,0,0,0,0,0,4,0,0,0,1,63,44,0,19,12,2,2016,9,17,2016-09-17,2070,8280,0.005314009662,0,0.00229468599,0.001449275362,0.0002415458937
4912,"San Diego County, CA, USA","California, USA",United States,32.93602,-117.25861,9/17/16,TVIA-SD4,3,0,3,1.13,1.81,0,3,1,0,0,1,0,0,0,1,1,1,0,1,0,0,0,0,0,0,0,0,0,1,0,0,0,0,0,1,0,0,1,0,0,0,0,0,0,9,0,0,0,0,0,0,0,0,0,0,15,36,11,1,5,3,1,2016,9,17,2016-09-17,1810,5430,0.002025782689,0.0001841620626,0.0009208103131,0.0005524861878,0.0001841620626
4913,"San Diego County, CA, USA","California, USA",United States,32.78243,-117.25112,9/17/16,Nlym ,2,0,2,6.2,0.02,0,125,48,9,0,7,0,7,2,0,0,0,8,0,0,0,0,1,0,0,0,0,0,1,0,0,0,0,0,9,0,0,4,0,0,0,0,0,6,51,0,0,0,0,0,0,0,0,0,0,20,298,219,1,74,125,0,2016,9,17,2016-09-17,20,40,5.475,0.025,1.85,3.125,0
4914,"San Diego County, CA, USA","California, USA",United States,32.75342,-117.25212,9/17/16,,1,0,1,0.24,2.04,0,15,0,1,0,8,0,1,2,1,0,0,0,3,0,0,0,1,0,0,0,0,0,0,0,0,0,0,0,2,0,0,0,0,0,0,0,0,0,0,0,0,0,0,0,0,0,0,0,0,8,42,34,0,17,15,3,2016,9,17,2016-09-17,2040,2040,0.01666666667,0,0.008333333333,0.007352941176,0.001470588235
4915,"San Diego County, CA, USA","California, USA",United States,32.85634,-117.25682,9/17/16,ASCE,4,0,4,1.61,2.63,0,5,2,0,0,3,0,0,0,2,0,1,0,0,0,0,0,0,0,0,0,0,0,0,0,0,0,0,0,2,0,0,0,0,0,0,0,0,2,12,0,0,0,0,0,0,2,0,0,0,23,54,18,0,7,5,0,2016,9,17,2016-09-17,2630,10520,0.001711026616,0,0.0006653992395,0.0004752851711,0
4916,"San Diego County, CA, USA","California, USA",United States,32.76955,-117.25329,9/17/16,Hartford,3,0,3,3,1.78,0,69,31,0,1,3,0,2,2,1,0,1,1,0,0,0,0,1,0,0,0,0,0,0,0,0,0,0,0,0,0,0,0,0,0,0,0,0,1,32,0,0,0,0,0,0,0,0,0,0,31,176,111,0,41,69,0,2016,9,17,2016-09-17,1780,5340,0.02078651685,0,0.007677902622,0.01292134831,0
4919,"San Diego County, CA, USA","California, USA",United States,32.76333,-117.12097,9/17/16,Sugar,5,0,5,10.52,0,0,0,0,0,0,0,0,0,0,0,0,0,0,0,0,0,0,0,0,0,0,0,0,0,0,0,0,0,0,0,0,0,0,0,0,0,0,0,0,0,0,0,0,0,0,0,0,0,0,0,0,0,0,0,0,0,0,2016,9,17,2016-09-17,0,0,NA,NA,NA,NA,NA
4920,"San Diego County, CA, USA","California, USA",United States,32.75229,-117.22871,9/17/16,,2,0,2,2.35,0,0,25,8,7,2,19,0,11,9,2,10,1,4,4,0,0,0,3,0,0,0,0,0,2,0,0,0,0,0,3,0,0,1,0,0,0,0,0,0,6,0,0,0,0,0,0,1,0,0,0,72,190,107,2,75,25,4,2016,9,17,2016-09-17,0,0,Inf,Inf,Inf,Inf,Inf
4924,"San Diego County, CA, USA","California, USA",United States,32.75593,-117.25076,9/17/16,Delta Sigma Pi,1,0,1,0.73,9.51,0,0,1,0,0,0,0,0,0,0,0,0,0,0,0,0,0,0,0,0,0,0,0,0,0,0,0,0,0,0,0,0,0,0,0,0,0,0,1,9,0,0,0,0,0,0,0,0,0,0,0,11,2,0,1,0,0,2016,9,17,2016-09-17,9510,9510,0.0002103049422,0,0.0001051524711,0,0
4926,"San Diego County, CA, USA","California, USA",United States,32.99136,-117.27419,9/17/16,,1,0,1,5.73,1.3,0,36,24,2,1,35,0,1,5,3,0,1,1,2,0,0,0,0,0,0,0,0,0,1,0,0,0,0,0,4,0,0,5,0,0,0,0,0,4,55,0,0,0,0,0,0,1,0,0,0,122,303,124,1,73,36,2,2016,9,17,2016-09-17,1300,1300,0.09538461538,0.0007692307692,0.05615384615,0.02769230769,0.001538461538
4929,"San Diego County, CA, USA","California, USA",United States,32.77017,-117.24901,9/17/16,,1,0,1,2.72,7.49,0,71,18,3,0,15,0,2,12,0,0,1,4,9,0,0,0,1,0,0,0,0,0,1,0,0,0,0,0,1,0,0,1,0,0,0,0,0,2,17,0,0,0,0,0,0,0,0,0,0,154,312,136,1,60,71,9,2016,9,17,2016-09-17,7490,7490,0.01815754339,0.0001335113485,0.008010680908,0.009479305741,0.001201602136
4932,"San Diego County, CA, USA","California, USA",United States,32.97847,-117.24737,9/17/16,,1,0,1,3.38,2.41,0,0,4,1,0,0,0,12,3,0,2,3,2,3,0,0,0,1,0,0,0,0,0,0,0,0,0,0,0,1,0,0,0,0,0,0,0,0,7,7,0,0,0,0,0,0,0,0,0,0,102,148,34,0,26,0,3,2016,9,17,2016-09-17,2410,2410,0.01410788382,0,0.01078838174,0,0.001244813278
4934,"San Diego County, CA, USA","California, USA",United States,33.09669,-117.19664,9/17/16,,3,0,3,3,0.67,0,24,19,3,1,14,0,13,11,2,6,3,11,5,0,0,0,5,0,0,0,0,0,0,0,0,0,0,0,6,0,0,3,0,0,0,0,0,2,12,0,0,0,0,0,0,3,0,0,0,8,151,117,0,79,24,5,2016,9,17,2016-09-17,670,2010,0.05820895522,0,0.03930348259,0.01194029851,0.002487562189
4935,"San Diego County, CA, USA","California, USA",United States,32.98024,-117.26906,9/17/16,AECOM,1,0,1,8.4,0.69,0,5,5,1,0,69,0,2,3,0,2,6,4,3,0,0,0,1,0,0,0,0,0,0,0,0,0,0,0,2,0,0,0,0,0,0,0,0,21,18,0,0,0,0,0,0,2,0,0,0,173,317,116,0,86,5,3,2016,9,17,2016-09-17,690,690,0.168115942,0,0.1246376812,0.007246376812,0.004347826087
4936,"San Diego County, CA, USA","California, USA",United States,32.7344,-117.16049,9/17/16,Club Pilates Bankers Hill,3,0,3,5.96,0.69,0,221,21,3,3,21,0,7,12,5,2,2,0,10,0,0,0,7,0,0,0,0,0,0,0,0,0,0,0,4,0,0,1,0,0,0,0,0,2,65,0,0,0,0,0,0,1,0,0,0,5,392,320,0,91,221,10,2016,9,17,2016-09-17,690,2070,0.154589372,0,0.04396135266,0.106763285,0.004830917874
4937,"San Diego County, CA, USA","California, USA",United States,32.75407,-117.25086,9/17/16,,1,0,1,5.56,1.5,0,32,11,1,0,4,0,2,0,0,0,0,1,1,0,0,0,1,0,0,0,0,0,0,0,0,0,0,0,4,0,0,0,0,0,0,0,0,0,92,0,0,0,0,0,0,0,0,0,0,22,171,56,0,20,32,1,2016,9,17,2016-09-17,1500,1500,0.03733333333,0,0.01333333333,0.02133333333,0.0006666666667
4944,"San Diego County, CA, USA","California, USA",United States,32.74843,-117.25232,9/17/16,,1,0,1,1.56,0.04,0,48,19,2,1,7,0,3,5,0,3,2,3,3,0,0,0,2,0,0,0,0,0,1,0,0,0,0,0,0,0,0,1,0,0,0,0,0,0,4,0,0,0,0,0,0,0,0,0,0,0,104,95,1,45,48,3,2016,9,17,2016-09-17,40,40,2.375,0.025,1.125,1.2,0.075
4952,"San Diego County, CA, USA","California, USA",United States,32.76335,-117.121,9/17/16,Sugar,1,0,1,3.99,0,0,0,0,0,0,0,0,0,0,0,0,0,0,0,0,0,0,0,0,0,0,0,0,0,0,0,0,0,0,0,0,0,0,0,0,0,0,0,0,0,0,0,0,0,0,0,0,0,0,0,0,0,0,0,0,0,0,2016,9,17,2016-09-17,0,0,NA,NA,NA,NA,NA
4962,"San Diego County, CA, USA","California, USA",United States,32.95002,-117.24697,9/17/16,Team UBS,10,0,10,8.75,5.64,0,41,17,3,0,10,0,0,4,2,7,23,27,7,0,0,0,3,0,0,0,0,0,4,0,0,0,0,0,4,0,0,3,0,0,0,0,0,3,5,0,0,0,0,0,0,3,0,0,0,49,215,111,4,53,41,7,2016,9,17,2016-09-17,5640,56400,0.001968085106,7.09E-05,0.0009397163121,0.0007269503546,0.0001241134752
4963,"San Diego County, CA, USA","California, USA",United States,32.75252,-117.22877,9/17/16,Famosa Slough,1,0,1,1.56,0.41,0,31,2,2,0,3,0,1,3,2,2,0,2,1,0,0,0,1,0,0,0,0,0,0,0,0,0,0,0,2,0,0,1,0,0,0,0,0,0,20,0,0,0,0,0,0,1,0,0,0,21,95,52,0,17,31,1,2016,9,17,2016-09-17,410,410,0.1268292683,0,0.04146341463,0.0756097561,0.00243902439
4964,"San Diego County, CA, USA","California, USA",United States,32.78259,-117.25112,9/17/16,Mbwc,1,0,1,7.48,0.04,0,101,442,1,0,82,0,0,41,2,8,2,0,2,0,0,0,0,0,0,0,0,0,0,0,0,0,0,0,0,0,0,3,0,0,0,0,0,2,0,0,0,0,0,0,0,0,0,0,0,12,698,684,0,578,101,2,2016,9,17,2016-09-17,40,40,17.1,0,14.45,2.525,0.05
4965,"San Diego County, CA, USA","California, USA",United States,33.13773,-117.33891,9/17/16,,2,0,2,0,0.4,0,4,5,0,0,0,0,0,1,0,0,0,0,0,0,0,0,0,0,0,0,0,0,0,0,0,0,0,0,0,0,0,1,0,0,0,0,0,0,16,0,0,0,0,0,0,0,0,0,0,24,51,11,0,6,4,0,2016,9,17,2016-09-17,400,800,0.01375,0,0.0075,0.005,0
4966,"San Diego County, CA, USA","California, USA",United States,33.19404,-117.38416,9/17/16,Cerruti family,3,0,3,2.39,2.73,0,36,10,3,0,0,0,0,0,1,0,0,0,3,0,0,0,0,0,0,0,0,0,3,0,0,0,0,0,2,0,0,2,0,0,0,0,0,1,14,0,0,0,0,0,0,0,0,0,0,55,130,61,3,17,36,3,2016,9,17,2016-09-17,2730,8190,0.007448107448,0.0003663003663,0.002075702076,0.004395604396,0.0003663003663
4967,"San Diego County, CA, USA","California, USA",United States,32.66571,-117.10534,9/17/16,,1,0,1,0.89,0.04,0,0,22,2,0,6,0,4,3,0,0,0,2,6,0,0,0,1,0,0,0,0,0,0,0,0,0,0,0,0,0,0,0,0,0,0,0,0,1,3,0,0,0,0,0,0,2,0,0,0,3,55,47,0,44,0,6,2016,9,17,2016-09-17,40,40,1.175,0,1.1,0,0.15
4969,"San Diego County, CA, USA","California, USA",United States,32.78262,-117.25122,9/17/16,,3,0,3,1.52,1.05,0,86,4,0,0,9,0,0,1,0,0,0,0,0,0,0,0,0,0,0,0,0,0,0,0,0,0,0,0,4,0,0,0,0,0,0,0,0,0,19,0,0,0,0,0,0,0,0,0,0,7,130,104,0,14,86,0,2016,9,17,2016-09-17,1050,3150,0.03301587302,0,0.004444444444,0.0273015873,0
4970,"San Diego County, CA, USA","California, USA",United States,32.74615,-117.05798,9/17/16,Zena Canyon,1,0,1,7.19,2.45,0,110,20,0,0,35,0,1,1,0,4,24,15,2,0,0,0,0,0,0,0,0,0,0,0,0,0,0,0,0,0,0,1,0,0,0,0,0,2,3,0,0,0,0,0,0,2,0,0,0,10,230,178,0,63,110,2,2016,9,17,2016-09-17,2450,2450,0.07265306122,0,0.02571428571,0.04489795918,0.0008163265306
4974,"San Diego County, CA, USA","California, USA",United States,33.14775,-117.34514,9/17/16,,1,0,1,3.11,2.64,0,2,0,0,0,2,0,0,0,0,0,0,0,0,0,0,0,1,0,0,0,0,0,0,0,0,0,0,0,0,0,0,3,0,0,0,0,0,0,53,0,0,0,0,0,0,1,0,0,0,38,100,9,0,3,2,0,2016,9,17,2016-09-17,2640,2640,0.003409090909,0,0.001136363636,0.0007575757576,0
4975,"San Diego County, CA, USA","California, USA",United States,33.13792,-117.33899,9/17/16,,4,0,4,1.91,0.01,0,3,0,0,0,1,0,0,2,2,0,0,0,0,0,0,0,0,0,0,0,0,0,0,0,0,0,0,0,3,0,0,3,0,0,0,0,0,4,14,0,0,0,0,0,0,3,0,0,0,7,42,21,0,5,3,0,2016,9,17,2016-09-17,10,40,0.525,0,0.125,0.075,0
4980,"San Diego County, CA, USA","California, USA",United States,32.73103,-117.15912,9/17/16,Banker's Hill Street Sweep,2,0,2,15.64,0.33,0,453,12,2,1,44,0,5,13,2,13,1,1,9,0,0,0,1,0,0,0,0,0,0,0,0,0,0,0,1,0,0,4,0,0,0,0,0,17,147,0,0,0,0,0,0,4,0,0,0,322,1052,581,0,102,453,9,2016,9,17,2016-09-17,330,660,0.8803030303,0,0.1545454545,0.6863636364,0.01363636364
4981,"San Diego County, CA, USA","California, USA",United States,32.75413,-117.25102,9/17/16,Hks,1,0,1,1.25,6.95,0,31,8,0,0,3,0,0,1,0,0,0,0,0,0,0,0,3,0,0,0,0,0,1,0,0,0,0,0,2,0,0,0,0,0,0,0,0,0,8,0,0,0,0,0,0,6,0,0,0,35,98,55,1,15,31,0,2016,9,17,2016-09-17,6950,6950,0.007913669065,0.0001438848921,0.002158273381,0.004460431655,0
4983,"San Diego County, CA, USA","California, USA",United States,32.79765,-117.21358,9/17/16,LMH,1,0,1,1.31,1.6,0,11,2,0,0,2,0,0,1,1,0,0,0,0,0,0,0,0,0,0,0,0,0,0,0,0,0,0,0,0,0,0,0,0,0,0,0,0,0,22,0,0,0,0,0,0,0,0,0,0,10,49,17,0,6,11,0,2016,9,17,2016-09-17,1600,1600,0.010625,0,0.00375,0.006875,0
4988,"San Diego County, CA, USA","California, USA",United States,33.0041,-117.11574,9/17/16,Tejidor Family with Alyanna Tejidor ,2,0,2,1.22,5.3,0,13,30,4,0,13,0,1,5,5,2,0,0,2,0,0,0,0,0,0,0,0,0,0,0,0,0,0,0,2,0,0,1,0,0,0,0,0,0,8,0,0,0,0,0,0,0,0,0,0,12,98,78,0,62,13,2,2016,9,17,2016-09-17,5300,10600,0.007358490566,0,0.005849056604,0.001226415094,0.0001886792453
4992,"San Diego County, CA, USA","California, USA",United States,32.93503,-117.26009,9/17/16,TVIA-SD4,4,0,4,0.01,0.18,0,0,0,0,0,0,0,0,0,0,0,0,0,0,0,0,0,0,0,0,0,0,0,0,0,0,0,0,0,0,0,0,0,0,0,0,0,0,0,0,0,0,0,0,0,0,0,0,0,0,2,2,0,0,0,0,0,2016,9,17,2016-09-17,180,720,0,0,0,0,0
4994,"San Diego County, CA, USA","California, USA",United States,32.93579,-117.26104,9/17/16,TVIA-SD4,3,0,3,0.39,1.94,0,2,2,0,0,0,0,0,0,0,2,0,0,0,0,0,0,0,0,0,0,0,0,0,0,0,0,0,0,0,0,0,0,0,0,0,0,0,0,5,0,0,0,0,0,0,0,0,0,0,9,20,6,0,4,2,0,2016,9,17,2016-09-17,1940,5820,0.001030927835,0,0.0006872852234,0.0003436426117,0
4997,"San Diego County, CA, USA","California, USA",United States,32.76335,-117.12095,9/17/16,Sugar,4,0,4,10.11,2.16,0,136,55,14,5,27,0,6,5,1,8,7,6,5,0,0,0,5,0,0,0,0,0,0,0,0,0,0,0,5,0,0,0,0,0,0,0,0,13,58,0,0,0,0,0,0,6,0,0,0,13,375,291,0,131,136,5,2016,9,17,2016-09-17,2160,8640,0.03368055556,0,0.01516203704,0.01574074074,0.0005787037037
4998,"San Diego County, CA, USA","California, USA",United States,33.36307,-117.20362,9/17/16,AVID Potter Junior High,45,0,45,0.08,1.68,0,10,0,0,0,0,0,0,0,0,0,0,0,0,0,0,0,0,0,0,0,0,0,0,0,0,0,0,0,0,0,0,0,0,0,0,0,0,0,1,0,0,0,0,0,0,0,0,0,0,0,11,10,0,0,10,0,2016,9,17,2016-09-17,1680,75600,0.0001322751323,0,0,0.0001322751323,0
4999,"San Diego County, CA, USA","California, USA",United States,33.02135,-117.28427,9/17/16,,4,0,4,0.45,1.29,0,6,14,0,0,4,0,1,1,0,0,0,0,0,0,0,0,0,0,0,0,0,0,0,0,0,0,0,0,2,0,0,0,0,0,0,0,0,0,16,0,0,0,0,0,0,0,0,0,0,132,176,28,0,20,6,0,2016,9,17,2016-09-17,1290,5160,0.005426356589,0,0.003875968992,0.001162790698,0
5001,"San Diego County, CA, USA","California, USA",United States,32.84365,-116.99713,9/17/16,Girl Scout troop 5294,11,0,11,23.01,2.5,0,102,27,12,3,11,0,0,4,1,2,51,11,13,0,0,0,0,0,0,0,0,0,1,0,0,0,0,0,3,0,0,0,0,0,0,0,0,7,141,0,0,0,0,0,0,7,0,0,0,23,419,193,1,73,102,13,2016,9,17,2016-09-17,2500,27500,0.007018181818,3.64E-05,0.002654545455,0.003709090909,0.0004727272727
5003,"San Diego County, CA, USA","California, USA",United States,33.02112,-117.28442,9/17/16,,1,0,1,0.37,0.61,0,19,5,0,0,1,0,0,0,0,0,0,0,0,0,0,0,0,0,0,0,0,0,0,0,0,0,0,0,0,0,0,1,0,0,0,0,0,0,4,0,0,0,0,0,0,1,0,0,0,2,33,27,0,6,19,0,2016,9,17,2016-09-17,610,610,0.04426229508,0,0.009836065574,0.03114754098,0
5004,"San Diego County, CA, USA","California, USA",United States,33.00204,-117.11673,9/17/16,,12,0,12,0.73,2.68,0,0,0,0,0,3,0,1,0,0,1,0,0,0,0,0,0,2,0,0,0,0,0,1,0,0,0,0,0,5,0,0,0,0,0,0,0,0,0,3,0,0,0,0,0,0,0,0,0,0,19,35,13,1,7,0,0,2016,9,17,2016-09-17,2680,32160,0.0004042288557,3.11E-05,0.0002176616915,0,0
5005,"San Diego County, CA, USA","California, USA",United States,32.76335,-117.12114,9/17/16,Sugar's Clean Up Normal Heights,1,0,1,7.39,0.97,0,79,65,9,12,38,0,31,24,1,6,3,6,29,0,0,0,11,0,0,0,0,0,1,0,0,0,0,0,41,0,0,2,0,0,0,0,0,0,45,0,0,0,0,0,0,0,0,0,0,20,423,349,1,226,79,29,2016,9,17,2016-09-17,970,970,0.3597938144,0.001030927835,0.2329896907,0.08144329897,0.02989690722
5006,"San Diego County, CA, USA","California, USA",United States,33.20387,-117.39335,9/17/16,Western center academy go green  club,4,0,4,3.08,0.36,0,66,5,0,0,10,0,2,5,2,0,0,1,0,0,0,0,5,0,0,0,0,0,0,0,0,0,0,0,49,0,0,6,0,0,0,0,0,3,2,0,0,0,0,0,0,1,0,0,0,10,167,154,0,29,66,0,2016,9,17,2016-09-17,360,1440,0.1069444444,0,0.02013888889,0.04583333333,0
5007,"San Diego County, CA, USA","California, USA",United States,32.9349,-117.25998,9/17/16,TVIA SD4,1,0,1,8.78,3.11,0,82,31,7,4,30,0,0,12,3,2,16,2,7,0,0,0,0,0,0,0,0,0,3,0,0,0,0,0,1,0,0,4,0,0,0,0,0,2,47,0,0,0,0,0,0,0,0,0,0,33,286,188,3,96,82,7,2016,9,17,2016-09-17,3110,3110,0.06045016077,0.0009646302251,0.0308681672,0.02636655949,0.002250803859
5010,"San Diego County, CA, USA","California, USA",United States,32.8053,-117.26216,9/17/16,Sdsu greenfest,1,0,1,8.11,3.44,0,136,51,0,0,21,0,1,6,3,0,1,3,4,0,0,0,0,0,0,0,0,0,0,0,0,0,0,0,6,0,0,5,0,0,0,0,0,7,66,0,0,0,0,0,0,9,0,0,0,247,566,249,0,86,136,4,2016,9,17,2016-09-17,3440,3440,0.07238372093,0,0.025,0.03953488372,0.001162790698
5012,"San Diego County, CA, USA","California, USA",United States,32.73481,-117.15961,9/17/16,Bankers Hill Street Sweep,1,0,1,9.14,0.05,0,86,2,0,0,12,0,2,5,2,1,0,0,3,0,0,0,1,0,0,0,0,0,0,0,0,0,0,0,0,0,0,2,0,0,0,0,0,5,130,0,0,0,0,0,0,1,0,0,0,120,372,122,0,28,86,3,2016,9,17,2016-09-17,50,50,2.44,0,0.56,1.72,0.06
5014,"San Diego County, CA, USA","California, USA",United States,32.73489,-117.1594,9/17/16,Solomon Ward,1,0,1,2.82,10.84,0,201,29,3,7,30,0,2,7,4,9,1,0,6,0,0,0,7,0,0,0,0,0,0,0,0,0,0,0,5,0,0,0,0,0,0,0,0,0,14,0,0,0,0,0,0,1,0,0,0,6,332,311,0,104,201,6,2016,9,17,2016-09-17,10840,10840,0.0286900369,0,0.009594095941,0.01854243542,0.0005535055351
5015,"San Diego County, CA, USA","California, USA",United States,32.7821,-117.25136,9/17/16,,1,0,1,2.1,2.15,0,58,6,3,0,3,0,2,1,1,0,2,0,1,0,0,0,1,0,0,0,0,0,0,0,0,0,0,0,0,0,0,0,0,0,0,0,0,0,22,0,0,0,0,0,0,3,0,0,0,8,111,79,0,18,58,1,2016,9,17,2016-09-17,2150,2150,0.03674418605,0,0.008372093023,0.02697674419,0.0004651162791
5018,"San Diego County, CA, USA","California, USA",United States,33.00184,-117.12054,9/17/16,,3,0,3,3.25,1.76,0,3,1,2,0,3,0,5,4,1,4,4,0,4,0,0,0,0,0,0,0,0,0,0,0,0,0,0,0,1,0,0,0,0,0,0,0,0,3,25,0,0,0,0,0,0,0,0,0,0,6,66,31,0,24,3,4,2016,9,17,2016-09-17,1760,5280,0.005871212121,0,0.004545454545,0.0005681818182,0.0007575757576
5019,"San Diego County, CA, USA","California, USA",United States,32.85867,-116.91511,9/17/16,Spencer-Villalobos FAMILY,4,0,4,4.75,0.48,0,386,43,0,0,26,0,11,3,6,4,4,0,8,0,0,0,2,0,0,0,0,0,0,0,0,0,0,0,6,0,0,12,0,0,0,0,0,0,27,0,0,0,0,0,0,10,0,0,0,0,548,517,0,103,386,8,2016,9,17,2016-09-17,480,1920,0.2692708333,0,0.05364583333,0.2010416667,0.004166666667
5022,"San Diego County, CA, USA","California, USA",United States,33.02176,-117.28364,9/17/16,Amy & Darrian,2,0,2,1.81,0.13,0,10,3,1,1,6,0,2,8,2,2,6,3,2,0,0,0,3,0,0,0,0,0,1,0,0,0,0,0,1,0,0,1,0,0,0,0,0,0,25,0,0,0,0,0,0,1,0,0,0,26,104,44,1,30,10,2,2016,9,17,2016-09-17,130,260,0.1692307692,0.003846153846,0.1153846154,0.03846153846,0.007692307692
5026,"San Diego County, CA, USA","California, USA",United States,33.13785,-117.33884,9/17/16,LEGOLAND California,1,0,1,6.99,1.82,0,555,55,1,1,19,0,3,2,0,1,7,1,2,0,0,0,0,0,0,0,0,0,4,0,0,0,0,0,0,0,0,0,0,0,0,0,0,0,35,0,0,0,0,0,0,0,0,0,0,22,708,643,4,84,555,2,2016,9,17,2016-09-17,1820,1820,0.3532967033,0.002197802198,0.04615384615,0.3049450549,0.001098901099
5028,"San Diego County, CA, USA","California, USA",United States,33.00364,-117.11503,9/17/16,DNHS AVID ,2,0,2,1.88,0,0,0,2,0,0,0,0,2,0,0,0,0,3,3,0,0,0,0,0,0,0,0,0,7,0,0,0,0,0,0,0,0,0,0,0,0,0,0,0,1,0,0,0,0,0,0,0,0,0,0,4,22,14,7,7,0,3,2016,9,17,2016-09-17,0,0,Inf,Inf,Inf,NA,Inf
5030,"San Diego County, CA, USA","California, USA",United States,32.76576,-117.12622,9/17/16,I love a clean 92116,1,0,1,3.29,0,0,118,7,0,0,3,0,5,1,0,0,0,0,3,0,0,0,0,0,0,0,0,0,0,0,0,0,0,0,5,0,0,1,0,0,0,0,0,0,48,0,0,0,0,0,0,1,0,0,0,2,194,144,0,19,118,3,2016,9,17,2016-09-17,0,0,Inf,NA,Inf,Inf,Inf
5032,"San Diego County, CA, USA","California, USA",United States,32.76334,-117.12103,9/17/16,Sugar,1,0,1,18.14,0,0,0,0,0,0,0,0,0,0,0,0,0,0,0,0,0,0,0,0,0,0,0,0,0,0,0,0,0,0,0,0,0,0,0,0,0,0,0,0,0,0,0,0,0,0,0,0,0,0,0,0,0,0,0,0,0,0,2016,9,17,2016-09-17,0,0,NA,NA,NA,NA,NA
5034,"San Diego County, CA, USA","California, USA",United States,32.76333,-117.12102,9/17/16,,1,0,1,6.1,1.13,0,153,40,1,0,2,0,3,2,0,10,1,0,2,0,0,0,2,0,0,0,0,0,0,0,0,0,0,0,3,0,0,2,0,0,0,0,0,0,79,0,0,0,0,0,0,1,0,0,0,41,342,221,0,62,153,2,2016,9,17,2016-09-17,1130,1130,0.1955752212,0,0.05486725664,0.1353982301,0.001769911504
5038,"San Diego County, CA, USA","California, USA",United States,32.77004,-117.1214,9/17/16,,1,0,1,0.96,2.45,0,26,4,0,2,0,0,1,1,4,0,1,0,0,0,0,0,0,0,0,0,0,0,0,0,0,0,0,0,0,0,0,0,0,0,0,0,0,0,9,0,0,0,0,0,0,0,0,0,0,8,56,38,0,12,26,0,2016,9,17,2016-09-17,2450,2450,0.01551020408,0,0.004897959184,0.0106122449,0
5042,"San Diego County, CA, USA","California, USA",United States,33.00409,-117.11548,9/17/16,,1,0,1,0.06,2.75,0,2,0,0,0,0,0,0,0,0,0,0,0,0,0,0,0,0,0,0,0,0,0,0,0,0,0,0,0,1,0,0,0,0,0,0,0,0,0,0,0,0,0,0,0,0,1,0,0,0,0,4,4,0,0,2,0,2016,9,17,2016-09-17,2750,2750,0.001454545455,0,0,0.0007272727273,0
5049,"San Diego County, CA, USA","California, USA",United States,33.14629,-117.3451,9/17/16,,1,0,1,0.62,2.46,0,9,0,0,1,2,0,1,2,0,0,0,1,0,0,0,0,0,0,0,0,0,0,0,0,0,0,0,0,0,0,0,0,0,0,0,0,0,0,8,0,0,0,0,0,0,0,0,0,0,25,49,15,0,6,9,0,2016,9,17,2016-09-17,2460,2460,0.006097560976,0,0.00243902439,0.003658536585,0
5052,"San Diego County, CA, USA","California, USA",United States,32.68075,-117.18173,9/17/16,Coronado beach,2,0,2,5.2,1.86,0,70,38,5,0,10,0,1,12,4,0,6,2,3,0,0,0,6,0,0,0,0,0,0,0,0,0,0,0,1,0,0,0,0,0,0,0,0,3,32,0,0,0,0,0,0,4,0,0,0,67,264,157,0,79,70,3,2016,9,17,2016-09-17,1860,3720,0.04220430108,0,0.02123655914,0.0188172043,0.0008064516129
5054,"San Diego County, CA, USA","California, USA",United States,33.00371,-117.11505,9/17/16,,1,0,1,8.7,4.57,0,2,3,8,1,3,0,2,1,1,16,5,5,4,0,0,0,0,0,0,0,0,0,0,0,0,0,0,0,1,0,0,0,0,0,0,0,0,23,25,0,0,0,0,0,0,0,0,0,0,37,137,65,0,39,2,4,2016,9,17,2016-09-17,4570,4570,0.01422319475,0,0.008533916849,0.0004376367615,0.000875273523
5068,"San Diego County, CA, USA","California, USA",United States,32.97844,-117.24741,9/17/16,I Love A Clean Sam Diego/AECOM,4,0,4,4.12,2.31,0,8,4,1,0,84,0,1,2,3,3,2,2,0,0,0,0,1,0,0,0,0,0,0,0,0,0,0,0,6,0,0,0,0,0,0,0,0,8,7,0,0,0,0,0,0,6,0,0,0,166,304,127,0,99,8,0,2016,9,17,2016-09-17,2310,9240,0.01374458874,0,0.01071428571,0.0008658008658,0
5069,"San Diego County, CA, USA","California, USA",United States,32.93499,-117.2608,9/17/16,,2,0,2,1.02,8.77,0,18,11,1,0,5,0,0,1,1,2,0,0,0,0,0,0,0,0,0,0,0,0,0,0,0,0,0,0,5,0,0,0,0,0,0,0,0,0,10,0,0,0,0,0,0,0,0,0,0,0,54,44,0,21,18,0,2016,9,17,2016-09-17,8770,17540,0.002508551881,0,0.001197263398,0.00102622577,0
5072,"San Diego County, CA, USA","California, USA",United States,32.79258,-117.04984,9/17/16,,2,0,2,3.04,3.28,0,61,36,7,1,2,0,0,6,2,4,4,2,3,0,0,0,0,0,0,0,0,0,1,0,0,0,0,0,4,0,0,5,0,0,0,0,0,1,4,0,0,0,0,0,0,5,0,0,0,33,181,138,1,61,61,3,2016,9,17,2016-09-17,3280,6560,0.02103658537,0.0001524390244,0.009298780488,0.009298780488,0.0004573170732
5074,"San Diego County, CA, USA","California, USA",United States,32.97841,-117.24747,9/17/16,,2,0,2,1.36,5.24,0,16,3,0,0,0,0,0,0,0,2,1,2,2,0,0,0,0,0,0,0,0,0,0,0,0,0,0,0,2,0,0,0,0,0,0,0,0,0,6,0,0,0,0,0,0,0,0,0,0,3,37,25,0,7,16,2,2016,9,17,2016-09-17,5240,10480,0.002385496183,0,0.0006679389313,0.001526717557,0.0001908396947
5078,"San Diego County, CA, USA","California, USA",United States,32.74677,-117.05795,9/17/16,,1,0,1,9.2,2.66,0,31,26,4,1,3,0,6,1,0,8,24,6,15,0,0,0,7,0,0,0,0,0,0,0,0,0,0,0,3,0,0,0,0,0,0,0,0,0,43,0,0,0,0,0,0,0,0,0,0,38,216,105,0,71,31,15,2016,9,17,2016-09-17,2660,2660,0.03947368421,0,0.02669172932,0.01165413534,0.005639097744
5081,"San Diego County, CA, USA","California, USA",United States,33.00466,-117.11499,9/17/16,,2,0,2,0.92,1.26,0,6,9,0,0,3,0,0,0,0,2,0,0,0,0,0,0,0,0,0,0,0,0,0,0,0,0,0,0,0,0,0,0,0,0,0,0,0,0,12,0,0,0,0,0,0,2,0,0,0,9,43,22,0,14,6,0,2016,9,17,2016-09-17,1260,2520,0.00873015873,0,0.005555555556,0.002380952381,0
5090,"San Diego County, CA, USA","California, USA",United States,33.00401,-117.11529,9/17/16,,2,0,2,1.45,2.87,0,1,3,1,0,1,0,0,0,0,1,2,0,3,0,0,0,0,0,0,0,0,0,0,0,0,0,0,0,0,0,0,1,0,0,0,0,0,2,6,0,0,0,0,0,0,0,0,0,0,18,39,13,0,9,1,3,2016,9,17,2016-09-17,2870,5740,0.002264808362,0,0.001567944251,0.0001742160279,0.0005226480836
5091,"San Diego County, CA, USA","California, USA",United States,32.76333,-117.12096,9/17/16,Sugar,1,0,1,5.99,0,0,0,0,0,0,0,0,0,0,0,0,0,0,0,0,0,0,0,0,0,0,0,0,0,0,0,0,0,0,0,0,0,0,0,0,0,0,0,0,0,0,0,0,0,0,0,0,0,0,0,0,0,0,0,0,0,0,2016,9,17,2016-09-17,0,0,NA,NA,NA,NA,NA
5097,"San Diego County, CA, USA","California, USA",United States,32.90652,-117.20609,9/17/16,Lopez canyon,30,0,30,14.99,0.12,0,113,27,18,27,11,0,7,17,3,61,15,47,23,0,0,0,8,0,0,0,0,0,0,0,0,0,0,0,15,0,0,5,0,0,0,0,0,22,29,0,0,0,0,0,0,0,0,0,0,33,481,357,0,202,113,23,2016,9,17,2016-09-17,120,3600,0.09916666667,0,0.05611111111,0.03138888889,0.006388888889
5105,"San Diego County, CA, USA","California, USA",United States,32.77437,-117.2501,9/17/16,Coastal cleanup sd,1,0,1,1.42,1.04,0,47,0,0,0,3,0,0,3,0,2,1,0,0,0,0,0,0,0,0,0,0,0,0,0,0,0,0,0,2,0,0,1,0,0,0,0,0,0,15,0,0,0,0,0,0,0,0,0,0,24,98,58,0,8,47,0,2016,9,17,2016-09-17,1040,1040,0.05576923077,0,0.007692307692,0.04519230769,0
5110,"San Diego County, CA, USA","California, USA",United States,32.91736,-117.17573,9/17/16,Lopez canyon,1,0,1,1.12,0.02,0,4,2,0,0,2,0,0,0,0,8,2,5,5,0,0,0,0,0,0,0,0,0,0,0,0,0,0,0,0,0,0,1,0,0,0,0,0,0,6,0,0,0,0,0,0,0,0,0,0,0,35,22,0,17,4,5,2016,9,17,2016-09-17,20,20,1.1,0,0.85,0.2,0.25
5111,"San Diego County, CA, USA","California, USA",United States,33.00372,-117.11497,9/17/16,Richelle 4s,1,0,1,2.48,1.9,0,4,45,2,1,5,0,1,3,3,4,1,1,3,0,0,0,1,0,0,0,0,0,1,0,0,0,0,0,3,0,0,0,0,0,0,0,0,0,17,0,0,0,0,0,0,3,0,0,0,14,112,79,1,68,4,3,2016,9,17,2016-09-17,1900,1900,0.04157894737,0.0005263157895,0.03578947368,0.002105263158,0.001578947368
5112,"San Diego County, CA, USA","California, USA",United States,32.76932,-117.25314,9/17/16,The Hartford,2,0,2,2.08,1.1,0,48,11,0,0,14,0,2,0,0,0,0,0,0,0,0,0,0,0,0,0,0,0,0,0,0,0,0,0,4,0,0,0,0,0,0,0,0,0,25,0,0,0,0,0,0,0,0,0,0,57,161,79,0,27,48,0,2016,9,17,2016-09-17,1100,2200,0.03590909091,0,0.01227272727,0.02181818182,0
5117,"San Diego County, CA, USA","California, USA",United States,32.69627,-117.05031,9/17/16,Girlscout troop 6904,7,0,7,7.86,3.81,0,2,11,6,5,0,0,4,2,0,6,8,1,16,0,0,0,4,0,0,0,0,0,0,0,0,0,0,0,0,0,0,0,0,0,0,0,0,10,54,0,0,0,0,0,0,0,0,0,0,8,137,66,0,54,2,16,2016,9,17,2016-09-17,3810,26670,0.002474690664,0,0.002024746907,7.50E-05,0.0005999250094
5119,"San Diego County, CA, USA","California, USA",United States,32.77563,-117.07274,9/17/16,SDSU Greenfest ,1,0,1,0.34,0,0,6,0,2,0,2,0,0,0,1,2,0,0,1,0,0,0,0,0,0,0,0,0,0,0,0,0,0,0,2,0,0,0,0,0,0,0,0,0,2,0,0,0,0,0,0,0,0,0,0,6,24,16,0,8,6,1,2016,9,17,2016-09-17,0,0,Inf,NA,Inf,Inf,Inf
5127,"San Diego County, CA, USA","California, USA",United States,32.58373,-117.03746,9/17/16,,2,0,2,0.03,0,0,2,0,0,0,0,0,0,0,0,0,0,0,1,0,0,0,0,0,0,0,0,0,0,0,0,0,0,0,0,0,0,0,0,0,0,0,0,0,0,0,0,0,0,0,0,0,0,0,0,3,6,3,0,1,2,1,2016,9,17,2016-09-17,0,0,Inf,NA,Inf,Inf,Inf
5130,"San Diego County, CA, USA","California, USA",United States,32.76321,-117.12105,9/17/16,,1,0,1,8.07,2.58,0,866,82,20,2,22,0,7,20,7,17,5,0,6,0,0,0,0,0,0,0,0,0,1,0,0,0,0,0,2,0,0,0,0,0,0,0,0,0,35,0,0,0,0,0,0,5,0,0,0,8,1105,1057,1,183,866,6,2016,9,17,2016-09-17,2580,2580,0.4096899225,0.0003875968992,0.07093023256,0.3356589147,0.002325581395
5131,"San Diego County, CA, USA","California, USA",United States,32.76966,-117.25314,9/17/16,The Hartford,4,0,4,0.5,0.04,0,13,0,0,2,8,0,1,3,0,2,0,2,1,0,0,0,1,0,0,0,0,0,0,0,0,0,0,0,0,0,0,3,0,0,0,0,0,1,1,0,0,0,0,0,0,0,0,0,0,1,39,35,0,18,13,1,2016,9,17,2016-09-17,40,160,0.21875,0,0.1125,0.08125,0.00625
5132,"San Diego County, CA, USA","California, USA",United States,32.93507,-117.25988,9/17/16,Boy Scout Troop 1212,9,0,9,2.88,3.54,0,6,5,0,0,2,0,1,0,0,10,4,3,1,0,0,0,2,0,0,0,0,0,0,0,0,0,0,0,5,0,0,0,0,0,0,0,0,1,21,0,0,0,0,0,0,1,0,0,0,0,62,34,0,21,6,1,2016,9,17,2016-09-17,3540,31860,0.001067168864,0,0.00065913371,0.0001883239171,3.14E-05
5133,"San Diego County, CA, USA","California, USA",United States,32.58689,-117.09172,9/17/16,,2,0,2,41.28,2.51,0,80,34,7,1,13,0,2,3,2,7,3,3,15,0,0,0,0,0,0,0,0,0,2,0,0,0,0,0,3,0,0,1,0,0,0,0,0,0,173,0,0,0,0,0,0,9,0,0,0,24,382,179,2,84,80,15,2016,9,17,2016-09-17,2510,5020,0.03565737052,0.0003984063745,0.01673306773,0.01593625498,0.002988047809
5136,"San Diego County, CA, USA","California, USA",United States,33.14799,-117.34579,9/17/16,,2,0,2,3.58,2.56,0,24,6,0,0,6,0,0,6,0,2,2,0,0,0,0,0,1,0,0,0,0,0,0,0,0,0,0,0,0,0,0,13,0,0,0,0,0,0,52,0,0,0,0,0,0,0,0,0,0,3,115,58,0,21,24,0,2016,9,17,2016-09-17,2560,5120,0.011328125,0,0.0041015625,0.0046875,0
5138,"San Diego County, CA, USA","California, USA",United States,33.02111,-117.28465,9/17/16,Coastal clean San elijo,1,0,1,3.19,1.09,0,6,17,0,0,3,0,1,2,0,0,0,0,1,0,0,0,0,0,0,0,0,0,0,0,0,0,0,0,1,0,0,0,0,0,0,0,0,0,25,0,0,0,0,0,0,0,0,0,0,339,395,31,0,24,6,1,2016,9,17,2016-09-17,1090,1090,0.02844036697,0,0.02201834862,0.005504587156,0.0009174311927
5141,"San Diego County, CA, USA","California, USA",United States,32.80551,-117.22231,9/17/16,,2,0,2,2.03,6.25,0,345,15,0,0,5,0,0,5,3,1,3,1,4,0,0,0,0,0,0,0,0,0,0,0,0,0,0,0,0,0,0,1,0,0,0,0,0,0,2,0,0,0,0,0,0,0,0,0,0,0,385,379,0,33,345,4,2016,9,17,2016-09-17,6250,12500,0.03032,0,0.00264,0.0276,0.00032
5142,"San Diego County, CA, USA","California, USA",United States,33.08317,-117.31074,9/17/16,Troop 2305 Coastal Cleanup,4,0,4,22.56,7.25,0,35,15,4,1,15,0,1,12,2,3,0,3,1,0,0,0,2,0,0,0,0,0,64,0,0,0,0,0,6,0,0,3,0,0,0,0,0,6,66,0,0,0,0,0,0,5,0,0,0,218,462,175,64,56,35,1,2016,9,17,2016-09-17,7250,29000,0.006034482759,0.002206896552,0.001931034483,0.001206896552,3.45E-05
5150,"San Diego County, CA, USA","California, USA",United States,32.74927,-117.24377,9/17/16,Surfrider Foundation TVHS club,3,0,3,2.56,3.74,0,36,11,4,2,13,0,2,11,2,2,1,2,0,0,0,0,3,0,0,0,0,0,5,0,0,0,0,0,0,0,0,4,0,0,0,0,0,0,6,0,0,0,0,0,0,0,0,0,0,47,151,95,5,50,36,0,2016,9,17,2016-09-17,3740,11220,0.008467023173,0.0004456327986,0.004456327986,0.00320855615,0
5155,"San Diego County, CA, USA","California, USA",United States,32.6962,-117.16896,9/17/16,Coronado beach,2,0,2,3.08,0,0,0,0,0,0,0,0,0,0,0,0,0,0,0,0,0,0,0,0,0,0,0,0,0,0,0,0,0,0,0,0,0,0,0,0,0,0,0,0,0,0,0,0,0,0,0,0,0,0,0,0,0,0,0,0,0,0,2016,9,17,2016-09-17,0,0,NA,NA,NA,NA,NA
5162,"San Diego County, CA, USA","California, USA",United States,33.15533,-117.35101,9/17/16,,5,0,5,1.3,29.35,0,24,6,0,0,7,0,0,1,2,0,0,0,0,0,0,0,0,0,0,0,0,0,0,0,0,0,0,0,5,0,0,1,0,0,0,0,0,1,13,0,0,0,0,0,0,0,0,0,0,0,60,47,0,16,24,0,2016,9,17,2016-09-17,29350,146750,0.0003202725724,0,0.0001090289608,0.0001635434412,0
5163,"San Diego County, CA, USA","California, USA",United States,32.80211,-117.08097,9/17/16,Girl Scouts Cub Scouts ,10,0,10,4.7,0,0,136,58,23,15,28,0,0,19,17,10,4,0,0,0,0,0,20,0,0,0,0,0,0,0,0,0,0,0,0,0,0,0,0,0,0,0,0,3,6,0,0,0,0,0,0,0,0,0,0,12,351,329,0,190,136,0,2016,9,17,2016-09-17,0,0,Inf,NA,Inf,Inf,NA
5169,"San Diego County, CA, USA","California, USA",United States,32.76274,-117.06168,9/17/16,Sigma Nu - SDSU,20,0,20,2.72,0.14,0,50,5,1,0,4,0,0,6,2,4,10,3,6,0,0,0,2,0,0,0,0,0,1,0,0,0,0,0,0,0,0,0,0,0,0,0,0,0,4,0,0,0,0,0,0,1,0,0,0,45,144,82,1,30,50,6,2016,9,17,2016-09-17,140,2800,0.02928571429,0.0003571428571,0.01071428571,0.01785714286,0.002142857143
5183,"San Diego County, CA, USA","California, USA",United States,32.64013,-117.11068,9/17/16,,3,0,3,13.34,1.07,0,65,26,16,9,81,0,12,53,14,4,6,0,9,0,0,0,3,0,0,0,0,0,4,0,0,0,0,0,47,0,0,0,0,0,0,0,0,9,82,0,0,0,0,0,0,12,0,0,0,179,631,364,4,227,65,9,2016,9,17,2016-09-17,1070,3210,0.1133956386,0.001246105919,0.0707165109,0.02024922118,0.002803738318
5199,"San Diego County, CA, USA","California, USA",United States,32.6968,-117.18146,9/17/16,I Love a Clean San Diego ,2,0,2,6.17,0.12,0,261,94,14,6,3,0,4,13,3,1,1,1,1,0,0,0,2,0,0,0,0,0,4,0,0,0,0,0,9,0,0,7,0,0,0,0,0,2,26,0,0,0,0,0,0,2,0,0,0,21,475,426,4,141,261,1,2016,9,17,2016-09-17,120,240,1.775,0.01666666667,0.5875,1.0875,0.004166666667
5233,"San Diego County, CA, USA","California, USA",United States,32.81444,-117.11048,9/16/16,,1,0,1,0.08,0.06,0,0,0,0,0,0,0,0,0,0,2,0,0,0,0,0,0,0,0,0,0,0,0,0,0,0,0,0,0,1,0,0,0,0,0,0,0,0,0,0,0,0,0,0,0,0,0,0,0,0,0,3,3,0,2,0,0,2016,9,16,2016-09-16,60,60,0.05,0,0.03333333333,0,0
5234,"San Diego County, CA, USA","California, USA",United States,32.80492,-117.24148,9/17/16,,1,0,1,0.19,0.01,0,8,1,0,0,3,0,0,0,0,0,0,1,0,0,0,0,0,0,0,0,0,0,0,0,0,0,0,0,0,0,0,2,0,0,0,0,0,0,1,0,0,0,0,0,0,0,0,0,0,15,31,14,0,4,8,0,2016,9,17,2016-09-17,10,10,1.4,0,0.4,0.8,0
5249,"San Diego County, CA, USA","California, USA",United States,32.76035,-117.14634,9/18/16,Sugar,1,0,1,0.3,0,0,110,0,0,0,0,0,0,0,0,0,0,0,0,0,0,0,0,0,0,0,0,0,0,0,0,0,0,0,0,0,0,0,0,0,0,0,0,0,0,0,0,0,0,0,0,0,0,0,0,0,110,110,0,0,110,0,2016,9,18,2016-09-18,0,0,Inf,NA,NA,Inf,NA
5269,"San Diego County, CA, USA","California, USA",United States,33.02074,-117.28432,9/18/16,,4,0,4,1.86,0.15,0,13,6,0,0,4,0,0,5,1,1,0,0,2,0,0,0,0,0,0,0,0,0,0,0,0,0,0,0,0,0,0,0,0,0,0,0,0,5,0,0,0,0,0,0,0,9,0,0,0,89,135,46,0,19,13,2,2016,9,18,2016-09-18,150,600,0.07666666667,0,0.03166666667,0.02166666667,0.003333333333
5308,"San Diego County, CA, USA","California, USA",United States,33.13368,-117.3365,9/19/16,LEGOLAND California,1,0,1,0.07,0.42,0,2,0,1,0,1,0,0,0,0,0,0,0,1,0,0,0,0,0,0,0,0,0,0,0,0,0,0,0,0,0,0,0,0,0,0,0,0,0,0,0,0,0,0,0,0,0,0,0,0,7,12,5,0,3,2,1,2016,9,19,2016-09-19,420,420,0.0119047619,0,0.007142857143,0.004761904762,0.002380952381
5311,"San Diego County, CA, USA","California, USA",United States,33.01919,-117.28349,9/19/16,,2,0,2,0.45,0.07,0,2,0,1,0,7,0,0,3,0,1,0,0,1,0,0,0,0,0,0,0,0,0,2,0,0,0,0,0,0,0,0,0,0,0,0,0,0,0,5,0,0,0,0,0,0,0,0,0,0,13,35,17,2,13,2,1,2016,9,19,2016-09-19,70,140,0.1214285714,0.01428571429,0.09285714286,0.01428571429,0.007142857143
5362,"San Diego County, CA, USA","California, USA",United States,33.01963,-117.28276,9/19/16,,1,0,1,0.45,0.11,0,10,5,0,0,5,0,3,5,0,0,0,0,2,0,0,0,0,0,0,0,0,0,0,0,0,0,0,0,0,0,0,1,0,0,0,0,0,0,25,0,0,0,0,0,0,0,0,0,0,76,132,31,0,20,10,2,2016,9,19,2016-09-19,110,110,0.2818181818,0,0.1818181818,0.09090909091,0.01818181818
5487,"San Diego County, CA, USA","California, USA",United States,32.78716,-117.20194,9/22/16,,1,0,1,0.23,0.01,0,0,2,0,0,5,0,0,0,0,0,0,0,0,0,0,0,0,0,0,0,0,0,0,0,0,0,0,0,0,0,0,0,0,0,0,0,0,0,10,0,0,0,0,0,0,0,0,0,0,10,27,7,0,7,0,0,2016,9,22,2016-09-22,10,10,0.7,0,0.7,0,0
5506,"San Diego County, CA, USA","California, USA",United States,33.12593,-117.31206,9/23/16,Legoland California ,1,0,1,0,0.03,0,2,0,0,0,0,0,0,0,0,0,0,0,0,0,0,0,0,0,0,0,0,0,0,0,0,0,0,0,0,0,0,0,0,0,0,0,0,0,0,0,0,0,0,0,0,0,0,0,0,0,2,2,0,0,2,0,2016,9,23,2016-09-23,30,30,0.06666666667,0,0,0.06666666667,0
5539,"San Diego County, CA, USA","California, USA",United States,33.13764,-117.33889,9/23/16,LEGOLAND California,1,0,1,1.63,5.9,0,2,9,2,1,7,0,0,3,0,0,0,0,1,0,0,0,0,0,0,0,0,0,1,0,0,0,0,0,0,0,0,2,0,0,0,0,0,4,2,0,0,0,0,0,0,0,0,0,0,29,63,32,1,23,2,1,2016,9,23,2016-09-23,5900,5900,0.005423728814,0.0001694915254,0.003898305085,0.0003389830508,0.0001694915254
5990,"San Diego County, CA, USA","California, USA",United States,33.14944,-117.34705,9/30/16,LEGOLAND California ,2,0,2,3.14,5.52,0,150,20,4,0,12,0,1,5,0,2,0,1,6,0,0,0,1,0,0,0,0,0,0,0,0,0,0,0,0,0,0,0,0,0,0,0,0,1,32,0,0,0,0,0,0,0,0,0,0,56,291,202,0,51,150,6,2016,9,30,2016-09-30,5520,11040,0.01829710145,0,0.004619565217,0.01358695652,0.0005434782609
6084,"San Diego County, CA, USA","California, USA",United States,32.66688991,-117.1046662,9/17/16,I Love A Clean San Diego,15,15,30,131.54,0.4,25,51,184,10,5,34,25,21,15,2,7,2,7,18,8,6,0,22,0,0,0,0,0,0,0,4,1,0,0,0,0,0,1,1,0,0,0,0,0,0,0,0,2,0,0,0,0,0,4,0,126,556,387,0,334,51,26,2016,9,17,2016-09-17,400,12000,0.03225,0,0.02783333333,0.00425,0.002166666667
6085,"San Diego County, CA, USA","California, USA",United States,32.77966167,-117.2482395,9/17/16,I Love A Clean San Diego,22,0,22,56.7,1.61,0,611,50,8,5,78,12,39,11,15,12,10,8,12,6,10,3,1,1,0,0,3,1,0,0,11,3,0,0,0,0,0,1,1,2,0,1,0,0,0,0,0,0,0,0,0,0,0,24,5,39,983,893,3,273,613,18,2016,9,17,2016-09-17,1610,35420,0.02521174478,8.47E-05,0.007707509881,0.01730660644,0.0005081874647
6088,"San Diego County, CA, USA","California, USA",United States,32.73842906,-117.09957,9/17/16,I Love A Clean San Diego,63,0,63,1360.78,0.4,0,399,174,13,5,61,39,24,23,16,49,39,23,67,71,19,30,44,18,1,1,0,0,0,10,13,10,13,49,0,0,17,10,26,11,10,0,19,0,0,0,0,5,0,2,0,0,0,6,208,138,1663,1109,2,594,459,138,2016,9,17,2016-09-17,400,25200,0.04400793651,7.94E-05,0.02357142857,0.01821428571,0.005476190476
6090,"San Diego County, CA, USA","California, USA",United States,33.15673872,-117.352953,9/17/16,I Love A Clean San Diego,112,0,112,44.45,6.44,9,598,207,8,13,107,71,32,58,22,27,45,24,8,8,7,6,2,0,1,0,1,1,0,0,25,0,0,0,0,0,0,7,11,9,10,3,0,0,0,0,0,0,1,2,3,0,0,181,56,95,1649,1320,2,698,607,16,2016,9,17,2016-09-17,6440,721280,0.001830079858,2.77E-06,0.0009677240461,0.0008415594499,2.22E-05
6092,"San Diego County, CA, USA","California, USA",United States,32.7649753,-117.218821,9/17/16,I Love A Clean San Diego,70,0,70,132.45,3.22,32,1115,397,37,2,118,60,72,61,24,61,24,13,68,129,112,23,31,32,2,9,30,22,0,1,42,10,11,17,0,0,2,8,18,4,19,82,3,0,0,0,0,8,0,5,0,0,0,44,75,378,3169,2333,41,1119,1136,197,2016,9,17,2016-09-17,3220,225400,0.01035048802,0.0001818988465,0.004964507542,0.005039929015,0.0008740017746
6094,"San Diego County, CA, USA","California, USA",United States,32.80419367,-117.2613931,9/17/16,I Love A Clean San Diego,116,0,116,13.61,1.61,0,475,111,12,3,73,74,24,40,14,37,12,19,21,28,28,16,19,24,3,4,1,8,0,0,0,2,15,5,0,0,7,9,8,3,7,0,2,1,0,0,0,3,0,0,2,0,0,265,32,377,1784,1193,8,671,483,49,2016,9,17,2016-09-17,1610,186760,0.00638787749,4.28E-05,0.003592846434,0.002586206897,0.0002623688156
6095,"San Diego County, CA, USA","California, USA",United States,33.06458956,-117.3052311,9/17/16,I Love A Clean San Diego,75,0,75,35.38,4.83,0,503,46,4,0,17,34,5,22,2,13,14,13,3,20,8,8,2,1,3,6,5,2,0,0,39,3,13,5,0,0,0,6,4,1,4,2,0,0,0,0,0,0,1,0,1,0,0,828,10,289,1937,1549,14,1002,509,23,2016,9,17,2016-09-17,4830,362250,0.00427605245,3.86E-05,0.002766045549,0.00140510697,6.35E-05
6097,"San Diego County, CA, USA","California, USA",United States,32.53559804,-117.1244717,9/17/16,I Love A Clean San Diego,20,92,112,295.29,1.61,0,164,392,128,88,862,51,139,201,136,314,44,36,66,152,20,37,267,87,16,16,12,63,0,19,194,77,24,12,0,0,2,125,32,23,63,11,16,0,0,0,0,8,1,11,12,0,0,862,1263,422,6468,4416,44,3907,199,218,2016,9,17,2016-09-17,1610,180320,0.02448979592,0.0002440106477,0.02166703638,0.001103593611,0.001208961846
6099,"San Diego County, CA, USA","California, USA",United States,32.72541472,-117.1933937,9/17/16,I Love A Clean San Diego,44,8,52,76.66,1.61,24,1181,261,60,106,211,24,44,39,9,84,12,34,60,41,111,75,21,160,3,0,1801,4,0,0,9,0,20,12,0,0,0,6,3,3,5,0,0,0,0,0,0,1,0,1,1,0,0,312,79,309,5102,4445,1804,1417,1196,101,2016,9,17,2016-09-17,1610,83720,0.05309364548,0.0215480172,0.01692546584,0.01428571429,0.001206402293
6101,"San Diego County, CA, USA","California, USA",United States,32.7537875,-117.2521448,9/17/16,I Love A Clean San Diego,100,4,104,28.58,8.05,6,493,80,13,12,61,36,64,32,6,22,7,6,11,14,3,13,9,4,1,12,2,4,0,0,13,2,12,9,0,0,0,3,44,1,5,1,0,0,0,0,0,2,1,0,1,0,0,142,4,327,1472,1020,15,483,503,25,2016,9,17,2016-09-17,8050,837200,0.001218346871,1.79E-05,0.0005769230769,0.0006008122312,2.99E-05
6118,"San Diego County, CA, USA","California, USA",United States,32.83344285,-117.0966625,9/17/16,I Love A Clean San Diego,29,11,40,9.07,0.8,0,2,28,5,0,4,1,2,1,0,5,7,4,2,3,0,0,0,0,0,0,0,0,0,0,1,0,0,2,0,0,0,0,0,0,0,0,0,0,0,0,0,0,0,0,0,0,0,0,8,10,85,55,0,51,4,5,2016,9,17,2016-09-17,800,32000,0.00171875,0,0.00159375,0.000125,0.00015625
6120,"San Diego County, CA, USA","California, USA",United States,32.80127183,-117.222147,9/17/16,I Love A Clean San Diego,100,40,140,2150.03,4.83,0,1250,672,83,58,211,170,69,259,21,87,37,33,103,88,92,32,34,22,8,6,6,7,0,4,47,15,0,50,0,0,2,53,5,12,60,0,1,0,0,0,0,3,3,7,2,0,0,194,635,351,4792,3365,20,1952,1312,191,2016,9,17,2016-09-17,4830,676200,0.004976338361,2.96E-05,0.002886719905,0.001940254363,0.0002824608104
6122,"San Diego County, CA, USA","California, USA",United States,32.73797783,-117.0923281,9/18/16,I Love A Clean San Diego,12,0,12,136.08,0.4,30,250,50,25,15,100,10,30,40,20,30,2,15,50,20,8,0,25,20,0,0,0,0,0,0,30,0,0,15,0,0,0,3,5,3,10,0,0,0,0,0,0,0,0,0,0,0,0,100,300,150,1326,826,0,555,268,70,2016,9,18,2016-09-18,400,4800,0.1720833333,0,0.115625,0.05583333333,0.01458333333
6123,"San Diego County, CA, USA","California, USA",United States,32.73664218,-117.1594584,9/17/16,I Love A Clean San Diego,20,3,23,25.72,3.22,0,410,81,2,0,28,5,11,34,19,12,2,1,9,17,7,41,8,4,0,0,0,0,0,0,36,12,1,7,0,0,0,2,0,2,1,0,0,0,0,0,0,1,4,0,0,0,0,17,4,127,905,716,0,278,419,26,2016,9,17,2016-09-17,3220,74060,0.009667836889,0,0.003753713206,0.005657574939,0.0003510667027
6124,"San Diego County, CA, USA","California, USA",United States,32.7555199,-117.0414734,9/17/16,I Love A Clean San Diego,6,25,31,66.68,1.61,20,1074,297,33,18,56,4,49,69,11,23,46,10,23,40,49,38,32,11,1,0,0,1,0,0,16,2,15,38,0,0,5,1,41,3,9,0,2,0,0,0,0,0,0,0,0,0,0,26,12,84,2139,1840,1,704,1115,63,2016,9,17,2016-09-17,1610,49910,0.03686635945,2.00E-05,0.0141053897,0.02234021238,0.00126227209
6125,"San Diego County, CA, USA","California, USA",United States,32.55809925,-117.0375896,9/17/16,I Love A Clean San Diego,2,4,6,226.8,0.4,20,150,100,0,0,0,10,0,0,0,10,120,50,10,0,0,0,0,0,0,0,0,0,0,0,0,30,0,0,0,0,0,0,0,0,0,0,3,0,0,0,0,0,1,0,0,0,0,0,100,0,584,304,0,120,150,10,2016,9,17,2016-09-17,400,2400,0.1266666667,0,0.05,0.0625,0.004166666667
6126,"San Diego County, CA, USA","California, USA",United States,32.74409629,-117.1534181,9/17/16,I Love A Clean San Diego,23,5,28,181.89,3.22,0,232,183,31,12,52,34,36,12,22,30,28,18,14,40,34,13,11,30,0,0,0,0,0,0,9,0,3,12,0,0,0,0,6,4,22,0,0,0,0,0,0,5,0,3,9,0,0,2,58,118,1083,747,0,484,248,54,2016,9,17,2016-09-17,3220,90160,0.00828527063,0,0.00536823425,0.002750665484,0.0005989352263
6127,"San Diego County, CA, USA","California, USA",United States,32.68004824,-117.1806264,9/17/16,I Love A Clean San Diego,142,7,149,95.25,3.22,80,961,656,19,24,335,128,79,255,35,64,142,103,66,53,63,62,13,34,3,20,14,28,0,2,191,6,97,51,0,0,0,47,127,4,26,133,0,0,0,0,0,11,3,1,10,0,0,483,782,1233,6364,3526,37,2309,1016,119,2016,9,17,2016-09-17,3220,479780,0.007349201717,7.71E-05,0.004812622452,0.00211763725,0.0002480303472
6128,"San Diego County, CA, USA","California, USA",United States,32.74541378,-117.1168113,9/17/16,I Love A Clean San Diego,9,3,12,907.18,1.61,0,20,30,0,0,20,10,5,20,16,15,20,20,15,5,3,0,0,50,0,1,0,0,0,1,0,0,0,25,0,0,2,10,0,10,0,1,0,0,0,0,0,5,0,0,5,0,0,30,70,80,489,278,1,207,55,20,2016,9,17,2016-09-17,1610,19320,0.01438923395,5.18E-05,0.01071428571,0.00284679089,0.001035196687
6130,"San Diego County, CA, USA","California, USA",United States,32.83169394,-117.2813809,9/17/16,I Love A Clean San Diego,60,16,76,29.94,3.22,0,348,123,5,5,25,34,17,20,8,5,4,12,6,7,4,12,6,2,0,1,3,4,0,3,12,3,9,9,0,0,0,5,10,3,11,1,0,0,0,0,0,1,0,0,0,0,0,286,48,98,1150,911,4,530,360,13,2016,9,17,2016-09-17,3220,244720,0.003722621772,1.63E-05,0.002165740438,0.001471068977,5.31E-05
6131,"San Diego County, CA, USA","California, USA",United States,32.73847418,-117.1041405,9/17/16,I Love A Clean San Diego,3,0,3,19.96,1,6,192,151,10,3,16,7,25,10,7,9,7,9,9,39,13,62,7,12,0,0,0,10,0,0,2,1,0,6,0,0,0,0,1,0,17,0,0,0,0,0,0,4,0,1,2,0,0,30,88,256,1006,532,0,330,198,48,2016,9,17,2016-09-17,1000,3000,0.1773333333,0,0.11,0.066,0.016
6132,"San Diego County, CA, USA","California, USA",United States,32.73258096,-117.1021986,9/17/16,I Love A Clean San Diego,10,1,11,19.05,0.8,0,8,10,1,0,10,27,3,6,7,13,12,0,10,6,0,0,0,6,0,0,0,0,0,0,0,5,0,2,0,0,0,0,0,0,0,0,4,0,0,0,0,13,9,1,7,0,0,11,16,25,212,119,0,83,10,16,2016,9,17,2016-09-17,800,8800,0.01352272727,0,0.009431818182,0.001136363636,0.001818181818
6133,"San Diego County, CA, USA","California, USA",United States,32.76329722,-117.115159,9/17/16,I Love A Clean San Diego,5,0,5,79.83,1.61,0,4676,91,9,2,64,42,15,41,36,2,5,1,3,3,6,6,21,0,0,0,0,0,0,0,0,0,0,5,0,0,0,0,0,0,0,0,0,0,0,0,0,0,0,0,0,0,0,0,42,55,5125,4968,0,287,4681,6,2016,9,17,2016-09-17,1610,8050,0.6171428571,0,0.03565217391,0.5814906832,0.0007453416149
6134,"San Diego County, CA, USA","California, USA",United States,32.77475445,-117.1986723,9/17/16,I Love A Clean San Diego,38,4,42,453.59,3.22,0,157,133,3,4,20,8,8,17,8,30,27,22,0,16,0,20,6,2,0,0,0,0,0,0,26,2,3,0,0,0,1,2,3,0,0,0,0,0,0,0,0,1,0,1,0,0,0,31,35,144,730,469,0,304,157,16,2016,9,17,2016-09-17,3220,135240,0.003467908903,0,0.002247855664,0.001160899142,0.0001183081928
6137,"San Diego County, CA, USA","California, USA",United States,32.83109894,-117.208457,9/17/16,I Love A Clean San Diego,60,0,60,562.45,0.8,0,175,310,84,65,110,90,90,66,36,120,60,60,80,80,14,28,36,30,1,0,3,10,0,6,20,20,14,20,0,0,1,2,14,10,20,10,2,0,0,0,0,2,0,6,0,0,0,50,600,360,2705,1436,4,1183,205,160,2016,9,17,2016-09-17,800,48000,0.02991666667,8.33E-05,0.02464583333,0.004270833333,0.003333333333
6138,"San Diego County, CA, USA","California, USA",United States,32.78467685,-117.2492695,9/17/16,I Love A Clean San Diego,75,30,105,58.97,3.22,0,2920,285,28,11,125,97,49,81,22,31,35,27,21,44,58,15,23,5,0,15,1,9,0,3,23,1,9,5,0,0,0,15,8,5,53,1,0,0,0,0,0,4,3,1,5,0,0,31,17,556,4642,3762,16,782,2930,65,2016,9,17,2016-09-17,3220,338100,0.01112688554,4.73E-05,0.00231292517,0.008666075126,0.0001922508134
6139,"San Diego County, CA, USA","California, USA",United States,32.75211823,-117.2280157,9/17/16,I Love A Clean San Diego,43,10,53,5.9,4.83,12,445,133,13,4,64,8,31,32,1,45,23,20,22,0,15,14,12,11,0,0,0,0,0,0,1,0,1,3,0,0,1,0,0,1,0,0,1,0,0,0,0,1,0,3,4,0,0,1,0,0,910,828,0,370,449,22,2016,9,17,2016-09-17,4830,255990,0.003234501348,0,0.00144536896,0.001753974765,8.59E-05
6140,"San Diego County, CA, USA","California, USA",United States,32.78568706,-117.0440483,9/17/16,I Love A Clean San Diego,4,6,10,2.72,0.4,1,50,28,0,0,0,0,0,4,3,5,1,0,0,0,0,0,0,0,0,0,0,0,0,0,0,0,0,0,0,0,0,0,0,0,0,0,0,0,0,0,0,0,0,0,0,0,0,0,0,0,91,90,0,40,50,0,2016,9,17,2016-09-17,400,4000,0.0225,0,0.01,0.0125,0
6142,"San Diego County, CA, USA","California, USA",United States,32.58384933,-117.1321106,9/17/16,I Love A Clean San Diego,141,0,141,79.38,3.22,0,487,226,13,4,203,27,51,51,32,21,13,36,9,23,12,24,49,10,2,11,9,9,0,1,30,0,7,7,0,0,1,16,79,7,13,7,1,0,0,0,0,3,0,0,0,0,0,136,16,836,2482,1406,22,859,501,32,2016,9,17,2016-09-17,3220,454020,0.003096779878,4.85E-05,0.001891987137,0.001103475618,7.05E-05
6143,"San Diego County, CA, USA","California, USA",United States,32.58384933,-117.1321106,9/17/16,I Love A Clean San Diego,141,0,141,79.38,3.22,0,487,226,13,4,203,27,51,51,32,21,13,36,9,23,12,24,49,10,2,11,9,9,0,1,30,0,7,7,0,0,1,16,79,7,13,7,1,0,0,0,0,3,0,0,0,0,0,136,16,836,2482,1406,22,859,501,32,2016,9,17,2016-09-17,3220,454020,0.003096779878,4.85E-05,0.001891987137,0.001103475618,7.05E-05
6144,"San Diego County, CA, USA","California, USA",United States,32.74048663,-117.085526,9/17/16,I Love A Clean San Diego,23,4,27,2449.4,1.61,0,0,0,0,0,10,0,0,5,5,10,15,5,10,10,0,0,0,0,0,0,0,0,0,0,10,5,0,0,0,0,0,0,0,0,40,0,3,0,0,0,0,0,0,0,0,0,0,0,0,0,128,68,0,60,0,20,2016,9,17,2016-09-17,1610,43470,0.001564297216,0,0.00138026225,0,0.0004600874166
6145,"San Diego County, CA, USA","California, USA",United States,32.74790432,-117.0888948,9/17/16,I Love A Clean San Diego,11,32,43,1814.37,1.61,0,48,59,15,2,0,12,5,7,6,21,15,0,11,9,0,8,18,0,0,1,0,0,0,0,3,5,0,0,0,0,1,11,1,18,0,0,2,0,0,0,0,1,5,1,0,0,0,5,105,22,417,252,1,161,66,20,2016,9,17,2016-09-17,1610,69230,0.003640040445,1.44E-05,0.002325581395,0.000953343926,0.0002888920988
6146,"San Diego County, CA, USA","California, USA",United States,32.64996275,-117.1109533,9/17/16,I Love A Clean San Diego,21,7,28,49.9,4.83,15,387,156,34,14,88,103,37,40,24,45,58,22,40,78,12,33,29,32,2,3,2,8,0,2,19,0,11,7,0,0,0,82,1,1,3,1,0,0,0,0,0,3,0,0,0,0,0,17,20,60,1474,1150,7,655,395,118,2016,9,17,2016-09-17,4830,135240,0.008503401361,5.18E-05,0.004843241644,0.002920733511,0.0008725229222
6147,"San Diego County, CA, USA","California, USA",United States,33.16356472,-117.0510864,9/17/16,I Love A Clean San Diego,100,76,176,249.48,8.05,58,0,0,0,0,0,0,0,0,0,0,0,0,0,0,0,0,0,0,0,0,0,0,0,0,0,0,0,0,0,0,0,0,0,0,0,0,0,0,0,0,0,0,0,0,0,0,0,0,0,0,0,0,0,0,0,0,2016,9,17,2016-09-17,8050,1416800,0,0,0,0,0
6148,"San Diego County, CA, USA","California, USA",United States,33.01694042,-117.2828293,9/17/16,I Love A Clean San Diego,70,122,192,55.34,3.22,6,164,95,0,0,20,0,3,20,0,8,2,4,1,7,2,6,0,0,0,0,0,1,0,0,33,0,3,2,0,0,0,9,0,1,1,0,0,0,0,0,0,0,0,0,0,0,0,147,3,67,599,513,0,334,167,8,2016,9,17,2016-09-17,3220,618240,0.0008297748447,0,0.0005402432712,0.0002701216356,1.29E-05
6151,"San Diego County, CA, USA","California, USA",United States,33.14096,-117.34048,9/28/16,LEGOLAND California,1,0,1,2.51,0.09,0,0,5,3,0,6,0,2,3,3,2,2,2,4,0,0,0,0,0,0,0,0,0,2,0,0,0,0,0,0,0,0,0,0,0,0,0,0,5,0,0,0,0,0,0,0,1,0,0,0,28,68,36,2,28,0,4,2016,9,28,2016-09-28,90,90,0.4,0.02222222222,0.3111111111,0,0.04444444444
6152,"San Diego County, CA, USA","California, USA",United States,33.14096,-117.34048,9/28/16,LEGOLAND California,1,0,1,2.51,0.09,0,0,5,3,0,6,0,2,3,3,2,2,2,4,0,0,0,0,0,0,0,0,0,2,0,0,0,0,0,0,0,0,0,0,0,0,0,0,5,0,0,0,0,0,0,0,1,0,0,0,28,68,36,2,28,0,4,2016,9,28,2016-09-28,90,90,0.4,0.02222222222,0.3111111111,0,0.04444444444
6157,"San Diego County, CA, USA","California, USA",United States,33.1527,-117.34972,10/3/16,LEGOLAND California,1,0,1,0.39,3.29,0,0,4,0,0,2,0,1,2,0,1,0,0,1,0,0,0,0,0,0,0,0,0,1,0,0,0,0,0,0,0,0,1,0,0,0,0,0,0,0,0,0,0,0,0,0,0,0,0,0,11,24,13,1,11,0,1,2016,10,3,2016-10-03,3290,3290,0.003951367781,0.0003039513678,0.003343465046,0,0.0003039513678
6345,"San Diego County, CA, USA","California, USA",United States,33.0139896,-117.278409,9/17/16,I Love A Clean San Diego,55,0,55,7.26,3.22,0,34,8,0,0,100,4,12,11,3,24,12,33,4,21,4,5,3,1,0,0,0,2,0,2,4,2,0,3,0,0,0,0,10,0,4,0,0,0,0,0,0,0,0,0,0,0,0,42,23,106,477,274,0,235,37,25,2016,9,17,2016-09-17,3220,177100,0.001547148504,0,0.001326933936,0.0002089215133,0.0001411631846
6346,"San Diego County, CA, USA","California, USA",United States,32.98066915,-117.2470164,9/17/16,I Love A Clean San Diego,1,0,1,54.43,3.22,0,15,3,1,0,1,0,0,0,0,0,0,0,2,2,0,0,0,0,0,0,0,0,0,0,0,0,2,0,0,0,0,0,0,0,0,0,0,0,0,0,0,0,0,0,0,0,0,0,0,0,26,26,0,9,15,4,2016,9,17,2016-09-17,3220,3220,0.008074534161,0,0.002795031056,0.004658385093,0.001242236025
6347,"San Diego County, CA, USA","California, USA",United States,32.95243186,-117.0488548,9/17/16,I Love A Clean San Diego,115,0,115,34.93,1.61,0,1564,1398,79,48,191,169,160,131,27,178,86,115,130,76,59,40,27,20,3,1,0,4,0,6,39,6,14,38,0,0,0,34,20,23,23,0,1,0,0,0,0,0,1,1,1,0,0,245,224,387,5569,4442,4,2755,1625,206,2016,9,17,2016-09-17,1610,185150,0.02399135836,2.16E-05,0.01487982717,0.008776667567,0.001112611396
6349,"San Diego County, CA, USA","California, USA",United States,32.93462251,-117.2607601,9/17/16,I Love A Clean San Diego,231,0,231,28.12,4.83,0,213,93,11,0,37,11,18,47,11,8,11,4,2,21,0,5,7,0,0,3,2,5,0,12,29,2,12,1,0,0,0,4,3,0,7,1,0,0,0,0,0,2,1,0,3,0,0,0,0,0,586,537,5,296,214,23,2016,9,17,2016-09-17,4830,1115730,0.0004812992391,4.48E-06,0.0002652971597,0.0001918026763,2.06E-05
6375,"San Diego County, CA, USA","California, USA",United States,33.1536,-117.35009,10/6/16,LEGOLAND California ,1,0,1,2.1,5.23,0,74,13,1,0,5,0,0,5,2,4,0,0,2,0,0,0,0,0,0,0,0,0,0,0,0,0,0,0,0,0,0,0,0,0,0,0,0,1,23,0,0,0,0,0,0,1,0,0,0,18,149,108,0,32,74,2,2016,10,6,2016-10-06,5230,5230,0.0206500956,0,0.006118546845,0.01414913958,0.0003824091778
6448,"San Diego County, CA, USA","California, USA",United States,32.84565,-117.27824,10/8/16,,1,0,1,0.45,0,0,1,5,0,0,0,0,0,1,0,2,2,1,1,0,0,0,0,0,0,0,0,0,0,0,0,0,0,0,0,0,0,0,0,0,0,0,0,0,1,0,0,0,0,0,0,0,0,0,0,0,14,10,0,9,1,1,2016,10,8,2016-10-08,0,0,Inf,NA,Inf,Inf,Inf
6451,"San Diego County, CA, USA","California, USA",United States,33.16034,-117.35596,10/8/16,LEGOLAND California,1,0,1,2.58,0.82,0,56,14,0,0,7,0,0,4,1,4,5,1,2,0,0,0,1,0,0,0,0,0,0,0,0,0,0,0,0,0,0,1,0,0,0,0,0,0,15,0,0,0,0,0,0,0,0,0,0,25,136,90,0,33,56,2,2016,10,8,2016-10-08,820,820,0.1097560976,0,0.04024390244,0.06829268293,0.00243902439
6463,"San Diego County, CA, USA","California, USA",United States,33.15801,-117.354,10/9/16,LEGOLAND California,1,0,1,6.59,4.87,0,37,9,1,1,4,0,0,1,7,15,10,14,11,0,0,0,12,0,0,0,0,0,1,0,0,0,0,0,0,0,0,0,0,0,0,0,0,10,10,0,0,0,0,0,0,0,0,0,0,40,183,109,1,61,37,11,2016,10,9,2016-10-09,4870,4870,0.02238193018,0.000205338809,0.01252566735,0.007597535934,0.002258726899
6490,"San Diego County, CA, USA","California, USA",United States,33.15331,-117.34979,10/10/16,LEGOLAND California ,1,0,1,3.19,5.24,0,86,17,1,1,16,0,2,4,2,4,0,1,3,0,0,0,1,0,0,0,0,0,1,0,0,0,0,0,4,0,0,1,0,0,0,0,0,3,20,0,0,0,0,0,0,14,0,0,0,17,198,160,1,51,86,3,2016,10,10,2016-10-10,5240,5240,0.03053435115,0.0001908396947,0.009732824427,0.01641221374,0.000572519084
6505,"San Diego County, CA, USA","California, USA",United States,32.79243,-117.23968,10/11/16,,1,0,1,0.45,1.21,0,0,0,0,0,0,0,0,0,0,0,0,0,0,0,0,0,0,0,0,0,0,0,0,0,0,0,0,0,0,0,0,0,0,0,0,0,0,0,92,0,0,0,0,0,0,0,0,0,0,0,92,0,0,0,0,0,2016,10,11,2016-10-11,1210,1210,0,0,0,0,0
6517,"San Diego County, CA, USA","California, USA",United States,33.18174087,-117.2972059,9/17/16,I Love A Clean San Diego,86,0,86,544.31,3.22,0,120,113,0,2,13,29,39,10,14,47,14,11,27,39,2,0,10,1,1,0,0,0,0,2,0,7,3,23,0,0,0,7,0,0,1,0,2,0,0,0,0,1,2,3,2,0,0,23,134,20,722,510,1,340,143,66,2016,9,17,2016-09-17,3220,276920,0.00184168713,3.61E-06,0.00122779142,0.0005163946266,0.0002383359815
6540,"San Diego County, CA, USA","California, USA",United States,32.90664974,-117.2314811,9/17/16,I Love A Clean San Diego,6,8,14,28.58,1.61,0,26,18,3,1,0,0,1,1,0,6,8,5,5,10,3,11,5,5,0,0,0,0,0,0,9,0,0,0,0,0,0,0,0,0,9,0,0,0,0,0,0,0,0,0,0,0,0,0,0,4,130,90,0,64,26,15,2016,9,17,2016-09-17,1610,22540,0.003992901508,0,0.002839396628,0.00115350488,0.0006654835847
6541,"San Diego County, CA, USA","California, USA",United States,32.73297807,-117.1663141,9/17/16,I Love A Clean San Diego,27,0,27,2721.55,1.61,0,26,26,3,1,11,10,8,2,0,21,9,17,8,4,0,0,4,0,1,0,0,0,0,0,4,0,0,0,0,0,0,0,0,0,3,0,0,0,0,0,0,0,0,0,0,0,0,0,14,15,187,119,1,92,26,12,2016,9,17,2016-09-17,1610,43470,0.002737520129,2.30E-05,0.002116402116,0.0005981136416,0.00027605245
6543,"San Diego County, CA, USA","California, USA",United States,32.77020782,-117.253089,9/17/16,I Love A Clean San Diego,278,0,278,106.59,1.61,0,3131,939,53,22,442,223,120,396,69,198,83,87,49,88,117,97,115,34,3,18,6,24,0,4,135,17,76,64,0,0,7,42,191,11,69,1,2,0,0,0,0,6,5,6,15,0,0,903,220,1526,9614,6963,27,3567,3206,137,2016,9,17,2016-09-17,1610,447580,0.0155569954,6.03E-05,0.007969525001,0.00716296528,0.0003060905313
6545,"San Diego County, CA, USA","California, USA",United States,33.14743293,-117.3462152,9/17/16,I Love A Clean San Diego,60,87,147,100.24,4.83,0,716,405,25,38,193,59,28,99,22,56,34,48,31,14,4,13,5,6,3,3,34,10,0,1,35,0,29,8,0,0,0,8,16,11,36,3,0,0,0,0,0,1,4,0,1,0,0,221,32,326,2578,1996,40,1179,735,45,2016,9,17,2016-09-17,4830,710010,0.002811228011,5.63E-05,0.001660539992,0.001035196687,6.34E-05
6546,"San Diego County, CA, USA","California, USA",United States,32.84296208,-116.9954681,9/17/16,I Love A Clean San Diego,80,0,80,222.71,1.61,0,616,421,44,30,129,34,40,54,18,72,114,42,77,28,40,5,14,15,0,0,0,7,0,1,31,2,4,25,0,0,0,2,8,14,11,4,1,0,0,0,0,2,1,1,4,0,0,33,389,310,2643,1677,0,1007,655,105,2016,9,17,2016-09-17,1610,128800,0.01302018634,0,0.007818322981,0.005085403727,0.0008152173913
6547,"San Diego County, CA, USA","California, USA",United States,33.16379824,-117.050786,9/17/16,I Love A Clean San Diego,100,76,176,249.48,8.05,58,0,0,0,0,0,0,0,0,0,0,0,0,0,0,0,0,0,0,0,0,0,0,0,0,0,0,0,0,0,0,0,0,0,0,0,0,0,0,0,0,0,0,0,0,0,0,0,0,0,0,0,0,0,0,0,0,2016,9,17,2016-09-17,8050,1416800,0,0,0,0,0
6570,"San Diego County, CA, USA","California, USA",United States,33.1583,-117.35391,10/11/16,LEGOLAND California,1,0,1,2.57,4.94,0,100,12,0,0,13,0,1,6,3,4,0,2,3,0,0,0,1,0,0,0,0,0,0,0,0,0,0,0,0,0,0,0,0,0,0,0,0,6,6,0,0,0,0,0,0,3,0,0,0,46,206,152,0,43,100,3,2016,10,11,2016-10-11,4940,4940,0.03076923077,0,0.008704453441,0.02024291498,0.0006072874494
6582,"San Diego County, CA, USA","California, USA",United States,32.83351497,-117.2816277,9/17/16,I Love A Clean San Diego,86,0,86,29.94,3.22,0,801,204,10,8,46,34,17,20,8,7,7,12,6,5,3,12,5,1,0,2,6,8,0,6,22,5,15,15,0,0,2,13,13,9,25,0,2,0,0,0,0,2,0,0,0,0,0,546,109,180,2186,1779,8,911,825,11,2016,9,17,2016-09-17,3220,276920,0.006424238047,2.89E-05,0.003289758775,0.002979199769,3.97E-05
6583,"San Diego County, CA, USA","California, USA",United States,32.93442441,-117.2608566,9/17/16,I Love A Clean San Diego,1,0,1,0.45,3.22,0,210,93,10,2,37,11,15,40,11,8,11,4,2,23,3,6,7,5,45,3,1,3,0,14,39,3,10,5,0,0,0,4,3,0,6,1,0,0,0,0,0,1,0,0,1,0,0,66,18,299,1020,654,49,372,215,25,2016,9,17,2016-09-17,3220,3220,0.2031055901,0.0152173913,0.1155279503,0.06677018634,0.007763975155
6585,"San Diego County, CA, USA","California, USA",United States,32.65093836,-117.1116829,9/17/16,I Love A Clean San Diego,32,0,32,49.9,4.83,0,387,156,33,13,104,103,37,40,24,45,58,22,51,67,15,30,35,32,2,3,2,8,0,2,19,0,11,7,0,0,0,82,1,1,3,1,0,0,0,0,0,3,0,0,0,0,0,17,20,60,1494,1170,7,675,395,118,2016,9,17,2016-09-17,4830,154560,0.007569875776,4.53E-05,0.004367236025,0.002555641822,0.0007634575569
6586,"San Diego County, CA, USA","California, USA",United States,32.79766449,-117.2136497,9/17/16,I Love A Clean San Diego,477,0,477,432.73,3.22,0,1819,635,328,19,343,288,190,127,52,64,58,33,377,47,37,34,45,28,0,3,1,3,0,2,31,4,9,33,0,0,6,96,74,2,98,0,0,0,0,0,0,13,0,8,5,0,0,138,533,500,6083,4406,4,2426,1854,424,2016,9,17,2016-09-17,3220,1535940,0.002868601638,2.60E-06,0.001579488782,0.001207078402,0.00027605245
6588,"San Diego County, CA, USA","California, USA",United States,32.69605779,-117.051537,9/17/16,I Love A Clean San Diego,16,0,16,165.56,1.61,0,598,369,66,19,112,60,70,33,48,80,105,38,34,116,70,35,23,39,0,0,0,0,0,0,18,2,6,25,0,0,0,0,14,8,40,0,0,0,0,0,0,16,0,5,12,0,0,4,100,239,2404,1687,0,1031,631,150,2016,9,17,2016-09-17,1610,25760,0.06548913043,0,0.04002329193,0.02449534161,0.005822981366
6686,"San Diego County, CA, USA","California, USA",United States,33.15876,-117.3546,10/13/16,LEGOLAND California,1,0,1,4.01,4.14,0,51,21,0,0,9,0,3,7,2,6,0,1,8,0,0,0,2,0,0,0,0,0,2,0,0,0,0,0,0,0,0,5,0,0,0,0,0,7,19,0,0,0,0,0,0,2,0,0,0,36,181,125,2,58,51,8,2016,10,13,2016-10-13,4140,4140,0.03019323671,0.0004830917874,0.01400966184,0.01231884058,0.00193236715
6756,"San Diego County, CA, USA","California, USA",United States,33.15874,-117.35454,10/15/16,LEGOLAND California,1,0,1,4.64,5.51,0,55,14,0,0,24,0,3,5,2,1,0,1,3,0,0,0,2,0,0,0,0,0,1,0,0,0,0,0,0,0,0,1,0,0,0,0,0,13,5,0,0,0,0,0,0,0,0,0,0,155,285,124,1,54,55,3,2016,10,15,2016-10-15,5510,5510,0.02250453721,0.0001814882033,0.009800362976,0.00998185118,0.0005444646098
6786,"San Diego County, CA, USA","California, USA",United States,33.14381,-117.34234,10/16/16,LEGOLAND California,1,0,1,3.2,2.13,0,18,4,1,0,28,0,4,3,0,2,0,0,4,0,0,0,3,0,0,0,0,0,3,0,0,0,0,0,0,0,0,1,0,0,0,0,0,7,5,0,0,0,0,0,0,1,0,0,0,64,148,79,3,49,18,4,2016,10,16,2016-10-16,2130,2130,0.03708920188,0.001408450704,0.02300469484,0.008450704225,0.001877934272
7139,"San Diego County, CA, USA","California, USA",United States,33.15877,-117.3546,10/21/16,LEGOLAND California,1,0,1,4.3,5.49,0,62,19,1,0,17,0,3,8,0,9,1,0,5,0,0,0,0,0,0,0,0,0,1,0,0,0,0,0,0,0,0,2,0,0,0,0,0,7,13,0,0,0,0,0,0,0,0,0,0,175,323,134,1,62,62,5,2016,10,21,2016-10-21,5490,5490,0.02440801457,0.0001821493625,0.01129326047,0.01129326047,0.0009107468124
7174,"San Diego County, CA, USA","California, USA",United States,33.14019,-117.34007,10/23/16,LEGOLAND California,1,0,1,3.56,2.17,0,33,16,0,0,18,0,0,8,1,1,0,1,2,0,0,0,4,0,0,0,0,0,1,0,0,0,0,0,0,0,0,2,0,0,0,0,0,10,6,0,0,0,0,0,0,4,0,0,0,46,153,100,1,50,33,2,2016,10,23,2016-10-23,2170,2170,0.04608294931,0.0004608294931,0.02304147465,0.01520737327,0.0009216589862
7227,"San Diego County, CA, USA","California, USA",United States,33.14369,-117.34235,10/24/16,LEGOLAND California,1,0,1,1.09,2.2,0,26,9,0,1,5,0,1,5,2,2,0,0,1,0,0,0,1,0,0,0,0,0,1,0,0,0,0,0,0,0,0,0,0,0,0,0,0,1,0,0,0,0,0,0,0,3,0,0,0,59,117,58,1,27,26,1,2016,10,24,2016-10-24,2200,2200,0.02636363636,0.0004545454545,0.01227272727,0.01181818182,0.0004545454545
7401,"San Diego County, CA, USA","California, USA",United States,33.13268,-117.33545,10/25/16,LEGOLAND California,1,0,1,1.36,2.01,0,37,7,0,1,7,0,2,7,2,1,0,1,9,0,0,0,3,0,0,0,0,0,1,0,0,0,0,0,0,0,0,0,0,0,0,0,0,1,5,0,0,0,0,0,0,1,0,0,0,47,132,79,1,39,37,9,2016,10,25,2016-10-25,2010,2010,0.03930348259,0.0004975124378,0.01940298507,0.0184079602,0.00447761194
7584,"San Diego County, CA, USA","California, USA",United States,33.14427,-117.34269,10/26/16,LEGOLAND California ,1,0,1,2.19,4.27,0,63,11,0,0,5,0,1,1,0,0,0,0,0,0,0,0,1,0,0,0,0,0,0,0,0,0,0,0,1,0,0,0,0,0,0,0,0,0,31,0,0,0,0,0,0,5,0,0,0,8,127,88,0,19,63,0,2016,10,26,2016-10-26,4270,4270,0.0206088993,0,0.004449648712,0.01475409836,0
7698,"San Diego County, CA, USA","California, USA",United States,32.75525,-117.12576,10/29/16,,1,0,1,0.52,0.96,0,58,1,0,0,0,0,2,0,0,0,1,0,3,0,0,0,4,0,0,0,0,0,0,0,0,0,0,0,0,0,0,0,0,0,0,0,0,0,0,0,0,0,0,0,0,0,0,0,0,12,81,68,0,10,58,3,2016,10,29,2016-10-29,960,960,0.07083333333,0,0.01041666667,0.06041666667,0.003125
7699,"San Diego County, CA, USA","California, USA",United States,32.74086,-117.13433,10/29/16,,2,0,2,0.79,2.13,0,284,1,0,0,0,0,0,1,0,0,0,0,0,0,0,0,0,0,0,0,0,0,0,0,0,0,0,0,0,0,0,0,0,0,0,0,0,0,0,0,0,0,0,0,0,0,0,0,0,1,287,286,0,2,284,0,2016,10,29,2016-10-29,2130,4260,0.06713615023,0,0.0004694835681,0.06666666667,0
7700,"San Diego County, CA, USA","California, USA",United States,32.74049,-117.13591,10/29/16,,1,0,1,1.62,0.16,0,292,5,0,0,3,0,2,0,2,2,0,1,3,0,0,0,5,0,0,0,0,0,0,0,0,0,0,0,0,0,0,0,0,0,0,0,0,0,11,0,0,0,0,0,0,1,0,0,0,0,327,315,0,22,292,3,2016,10,29,2016-10-29,160,160,1.96875,0,0.1375,1.825,0.01875
7701,"San Diego County, CA, USA","California, USA",United States,33.15752,-117.35369,10/29/16,LEGOLAND California,1,0,1,1.73,7.18,0,115,8,0,0,18,0,3,5,0,1,1,11,3,0,0,0,2,0,0,0,0,0,0,0,0,0,0,0,1,0,0,0,0,0,0,0,0,1,7,0,0,0,0,0,0,0,0,0,0,39,215,157,0,40,115,3,2016,10,29,2016-10-29,7180,7180,0.02186629526,0,0.005571030641,0.01601671309,0.0004178272981
7709,"San Diego County, CA, USA","California, USA",United States,32.74021,-117.03219,10/29/16,The Living Coast Discovery Center,2,0,2,0.26,0.03,0,4,6,1,0,0,0,4,6,0,1,0,1,4,0,0,0,1,0,0,0,0,0,0,0,0,0,0,0,0,0,0,0,0,0,0,0,0,0,0,0,0,0,0,0,0,1,0,0,0,9,38,28,0,23,4,4,2016,10,29,2016-10-29,30,60,0.4666666667,0,0.3833333333,0.06666666667,0.06666666667
7713,"San Diego County, CA, USA","California, USA",United States,32.92595,-117.13433,10/29/16,Living Coast Discovery Center,1,0,1,6.8,0.02,0,0,10,4,0,0,0,0,0,0,15,2,2,8,0,0,0,1,0,0,0,0,0,0,0,0,0,0,0,0,0,0,0,0,0,0,0,0,0,20,0,0,0,0,0,0,0,0,0,0,0,62,38,0,38,0,8,2016,10,29,2016-10-29,20,20,1.9,0,1.9,0,0.4
7715,"San Diego County, CA, USA","California, USA",United States,33.15877,-117.3541,10/30/16,LEGOLAND California,1,0,1,2.69,5.26,0,40,9,0,0,8,0,0,4,0,3,2,2,3,0,0,0,1,0,0,0,0,0,1,0,0,0,0,0,2,0,0,0,0,0,0,0,0,4,3,0,0,0,0,0,0,3,0,0,0,90,175,78,1,28,40,3,2016,10,30,2016-10-30,5260,5260,0.01482889734,0.0001901140684,0.005323193916,0.007604562738,0.0005703422053
7788,"San Diego County, CA, USA","California, USA",United States,33.13813,-117.33912,10/31/16,LEGOLAND California,1,0,1,0.43,1.46,0,51,4,0,0,2,0,0,2,1,0,0,0,0,0,0,0,0,0,0,0,0,0,0,0,0,0,0,0,0,0,0,0,0,0,0,0,0,0,3,0,0,0,0,0,0,0,0,0,0,15,78,60,0,9,51,0,2016,10,31,2016-10-31,1460,1460,0.04109589041,0,0.006164383562,0.03493150685,0
8107,"San Diego County, CA, USA","California, USA",United States,33.20631,-117.38953,11/4/16,LEGOLAND California,1,0,1,6.26,2.64,0,252,14,1,0,6,0,4,5,1,10,2,8,17,0,0,0,5,0,0,0,0,0,13,0,0,0,0,0,4,0,0,1,0,0,0,0,0,0,18,0,0,0,0,0,0,0,0,0,0,9,370,333,13,63,252,17,2016,11,4,2016-11-04,2640,2640,0.1261363636,0.004924242424,0.02386363636,0.09545454545,0.006439393939
10589,"San Diego County, CA, USA","California, USA",United States,33.13412,-117.3374,11/5/16,LEGOLAND California,1,0,1,1.28,1.13,0,15,5,1,0,5,0,2,3,0,3,0,0,0,0,0,0,2,0,0,0,0,0,0,0,0,0,0,0,0,0,0,1,0,0,0,0,0,4,1,0,0,0,0,0,0,0,0,0,0,18,60,41,0,21,15,0,2016,11,5,2016-11-05,1130,1130,0.03628318584,0,0.0185840708,0.01327433628,0
10616,"San Diego County, CA, USA","California, USA",United States,32.93647,-117.25764,11/5/16,LEGOLAND California,1,0,1,0.16,0.22,0,26,0,0,0,0,0,1,1,0,2,0,0,2,0,0,0,0,0,0,0,0,0,0,0,0,0,0,0,0,0,0,0,0,0,0,0,0,0,0,0,0,0,0,0,0,0,0,0,0,5,37,32,0,6,26,2,2016,11,5,2016-11-05,220,220,0.1454545455,0,0.02727272727,0.1181818182,0.009090909091
10645,"San Diego County, CA, USA","California, USA",United States,33.20401,-117.39108,11/6/16,LEGOLAND California,1,0,1,1.87,2.16,0,45,12,1,1,4,0,3,4,2,4,0,7,1,0,0,0,8,0,0,0,0,0,2,0,0,0,0,0,0,0,0,0,0,0,0,0,0,2,4,0,0,0,0,0,0,0,0,0,0,18,118,89,2,40,45,1,2016,11,6,2016-11-06,2160,2160,0.0412037037,0.0009259259259,0.01851851852,0.02083333333,0.000462962963
10716,"San Diego County, CA, USA","California, USA",United States,33.13829,-117.339,11/7/16,LEGOLAND California,1,0,1,1.57,1.91,0,19,6,1,0,6,0,0,1,0,3,2,0,2,0,0,0,1,0,0,0,0,0,0,0,0,0,0,0,0,0,0,0,0,0,0,0,0,3,0,0,0,0,0,0,0,1,0,0,0,33,78,43,0,20,19,2,2016,11,7,2016-11-07,1910,1910,0.02251308901,0,0.01047120419,0.009947643979,0.001047120419
10842,"San Diego County, CA, USA","California, USA",United States,33.13344,-117.33633,11/9/16,LEGOLAND California,1,0,1,2.18,2.65,0,54,5,1,0,15,0,3,11,2,1,2,1,3,0,0,0,6,0,0,0,0,0,3,0,0,0,0,0,1,0,0,3,0,0,0,0,0,1,2,0,0,0,0,0,0,4,0,0,0,26,144,113,3,47,54,3,2016,11,9,2016-11-09,2650,2650,0.04264150943,0.001132075472,0.01773584906,0.02037735849,0.001132075472
11004,"San Diego County, CA, USA","California, USA",United States,33.20636,-117.3893,11/10/16,LEGOLAND California,1,0,1,2.01,2.05,0,28,2,0,2,2,0,6,4,1,3,3,6,7,0,0,0,11,0,0,0,0,0,3,0,0,0,0,0,0,0,0,0,0,0,0,0,0,0,1,0,0,0,0,0,0,0,0,0,0,9,88,69,3,38,28,7,2016,11,10,2016-11-10,2050,2050,0.03365853659,0.001463414634,0.01853658537,0.01365853659,0.003414634146
11014,"San Diego County, CA, USA","California, USA",United States,32.99705,-117.24891,11/10/16,,1,0,1,9.07,0.02,0,13,14,6,2,8,0,3,5,1,6,2,5,5,0,0,0,1,0,0,0,0,0,0,0,0,0,0,0,7,0,0,3,0,0,0,0,0,3,5,0,0,0,0,0,0,0,0,0,0,21,110,77,0,51,13,5,2016,11,10,2016-11-10,20,20,3.85,0,2.55,0.65,0.25
11029,"San Diego County, CA, USA","California, USA",United States,32.77126,-117.20298,11/12/16,Sunday Assembly San Diego,2,0,2,1.04,1.32,0,59,0,0,0,3,0,0,0,0,0,0,0,0,0,0,0,0,0,0,0,0,0,0,0,0,0,0,0,5,0,0,0,0,0,0,0,0,1,5,0,0,0,0,0,0,0,0,0,0,41,114,68,0,3,59,0,2016,11,12,2016-11-12,1320,2640,0.02575757576,0,0.001136363636,0.02234848485,0
11030,"San Diego County, CA, USA","California, USA",United States,32.76488,-117.2147,11/12/16,Sunday Assembly San Diego,3,0,3,2.91,0.13,0,5,4,0,1,5,0,0,1,0,2,0,3,6,0,0,0,0,0,0,0,0,0,4,0,0,0,0,0,0,0,0,0,0,0,0,0,0,4,10,0,0,0,0,0,0,1,0,0,0,51,97,33,4,19,5,6,2016,11,12,2016-11-12,130,390,0.08461538462,0.01025641026,0.04871794872,0.01282051282,0.01538461538
11031,"San Diego County, CA, USA","California, USA",United States,32.7649,-117.21478,11/12/16,Sunday Assembly San Diego,1,0,1,0.36,0,0,21,1,0,0,0,0,0,0,0,0,0,0,0,0,0,0,0,0,0,0,0,0,1,0,0,0,0,0,1,0,0,0,0,0,0,0,0,0,0,0,0,0,0,0,0,0,0,0,0,1,25,24,1,1,21,0,2016,11,12,2016-11-12,0,0,Inf,Inf,Inf,Inf,NA
11032,"San Diego County, CA, USA","California, USA",United States,32.76489,-117.21471,11/12/16,Sunday Assembly San Diego,3,0,3,1.66,0,0,139,2,0,0,1,0,0,0,0,0,1,0,0,0,0,0,0,0,0,0,0,0,0,0,0,0,0,0,0,0,0,0,0,0,0,0,0,0,16,0,0,0,0,0,0,1,0,0,0,30,190,143,0,3,139,0,2016,11,12,2016-11-12,0,0,Inf,NA,Inf,Inf,NA
11033,"San Diego County, CA, USA","California, USA",United States,32.76491,-117.21473,11/12/16,Sunday Assembly San Diego,1,0,1,0.37,0,0,34,0,0,1,0,0,0,0,0,0,0,0,3,0,0,0,1,0,0,0,0,0,0,0,0,0,0,0,0,0,0,0,0,0,0,0,0,0,4,0,0,0,0,0,0,0,0,0,0,1,44,39,0,5,34,3,2016,11,12,2016-11-12,0,0,Inf,NA,Inf,Inf,Inf
11034,"San Diego County, CA, USA","California, USA",United States,32.76847,-117.20821,11/12/16,Sunday Assembly San Diego,2,0,2,2.68,0.73,0,46,7,1,0,7,0,0,0,0,0,0,0,5,0,0,0,3,0,0,0,0,0,0,0,0,0,0,0,0,0,0,0,0,0,0,0,0,5,22,0,0,0,0,0,0,0,0,0,0,5,101,74,0,23,46,5,2016,11,12,2016-11-12,730,1460,0.05068493151,0,0.01575342466,0.03150684932,0.003424657534
